category,name,nameEN,description,descriptionEN,hours,manager,website,email,phone,fax,weeklyClosing,services,ticketCost,ticketEmail,ticketPhone,ticketHours,ticketReductions,addressStreet,addressLocation,addressCap,addressMunicipalities,addressProvince,addressRegion,addressText,latitude,longitude,photo,accessibility,visibleCopy,sponsor,hidden,unreachable
art,,,"La bellissima stele di Tirano assume una particolare valenza per la documentazione della storia più antica della Valtellina in quanto finora è l'unica ad essere stata rinvenuta al di fuori del contesto collinare di Teglio. Il manufatto risale all'età del Rame, viene datato al periodo compreso tra il 2800 e il 2400 a.C.Le 24 incisioni che compongono la figurazione si trovano quasi tutte sulla faccia anteriore. Si distinguono facilmente vari tipi di animali, in particolare gli stambecchi, rappresentati accanto agli strumenti della caccia: un'ascia e un'alabarda sono insieme alla figura di un arciere, compaiono inoltre un pugnale con il fodero e, più in basso, un cinturone a festoni.",,,,,,,,,,,,,,,,,23036,Teglio,SO,,"Via Fabio Besta, 1 23036 SO",,,http://www.bellalombardia.regione.lombardia.it/LBL/medium/RA-SO100-00003-IMG-0000095446.jpg,,SIRBEC,,,
art,,,"I Maestri campionesi sono architetti e scultori lombardi così chiamati per la comune origine dalla città di Campione sul lago di Lugano nel Ticino e attivi tra il XII e il XIV secolo in Val Padana tra Bergamo, Monza, Milano e Modena. Giovanni da Campione, uno dei principali esponenti di questo movimento, progetta ed esegue come sua prima opera bergamasca, tra il 1340 e il 1341, il battistero in marmi scolpiti collocato in origine nella navata centrale della Basilica di S. Maria Maggiore e rimontato ""in stile"" nel giardino dell'Episcopio alla fine del XIX secolo. Le sculture che lo ornano, tra cui le otto ""Virtù"" scolpite nei pilastrini angolari esterni, gli otto rilievi interni con ""Storie di Cristo"" e la statua di ""San Giovanni Battista"" a grandezza naturale sono tra le opere più significative di questo artista per vigore espressivo e finezza di modellato.",,,,,,,,,,,,,,,,,24100,Bergamo,BG,,Piazza Duomo 24100 BG,,,http://www.bellalombardia.regione.lombardia.it/LBL/medium/OA-BG140-00036-IMG-0000475400.jpg,,SIRBEC,,,
art,Vittoria alata,,"La statua è realizzata con il metodo della fusione a cera persa indiretta e risulta costituita da almeno trenta parti fuse singolarmente e saldate poi tra loro; è inoltre rifinita con strumenti a punta che ne definiscono con precisione i dettagli. Dovette essere prodotta nel secondo quarto del I secolo d. C. da un'officina bronzistica di alto livello dell'Italia settentrionale.La posizione della figura, con una gamba leggermente sollevata e le braccia avanzate, si spiega con la presenza in origine di alcuni attributi che permettevano di identificarne il soggetto. Il piede doveva infatti poggiare sull'elmo di Marte, il dio della guerra, e il braccio sinistro doveva trattenere uno scudo, sul quale erano incisi il nome e le gesta del vincitore (con queste caratteristiche veniva infatti rappresentata dai romani la dea Vittoria). La statua, scoperta il 20 luglio del 1826 in occasione degli scavi archeologici conodotti presso il Capitolium costituisce e uno dei pochi casi di statue in bronzo conservatesi, l'unico in Italia settentrionale.",,,,,,,,,,,,,,,,,25121,Brescia,BS,,"Via dei Musei, 81/b 25121 BS",,,http://www.bellalombardia.regione.lombardia.it/LBL/medium/OA-2k100-00011-IMG-0000477986.jpg,,SIRBEC,,,
art,Ritratto di Paolo Morigia,,"Il ritratto del generale dei gesuati (Chierici apostolici di San Gerolamo) Paolo Morigia colpisce per l'abilità esecutiva dell'autrice e fu molto elogiato dallo stesso religioso che affermò essere perfettamente rassomigliante: ""rassomigliando talmente al naturale, che più non si può desiderare"". L'iscrizione sul margine superiore della tela non sembra attendibile per quanto concerne la datazione e sarebbe stata aggiunta solo al momento dell'ingresso dell'opera in Ambrosiana, dopo la soppressione dei Gesuati nel 1668; la critica oggi suggerisce una datazione tra il 1592 e il 1595. Del Morigia viene messo in risalto non tanto il suo essere religioso, quanto piuttosto il suo aspetto di storico erudito e non si manchi di notare, nella sua mano sinistra, un paio di occhiali. La resa naturalistica e puntigliosa degli oggetti ci ricorda che Fede Galizia fu anche esecutrice di nature morte. La carta sulla quale il frate scrive riporta dei versi di Borgogni riferentesi al dipinto e alle abilità pittoriche dell'autrice.",,,,,,,,,,,,,,,,,20123,Milano,MI,,"Piazza Pio XI, 2 20123 MI",,,http://www.bellalombardia.regione.lombardia.it/LBL/medium/OA-L0060-00029-IMG-0000477367.jpg,,SIRBEC,,,
art,Ritratto di Elisabetta Sottocasa,,"Il dipinto eseguito nel 1874 rappresenta il capolavoro della ritrattistica ufficiale di Mosè Bianchi, il maggiore pittore monzese dell'Ottocento. Ripresa con grande naturalezza sulla soglia del giardino, nell'atto di girarsi verso il pittore, la figura di Elisabetta Sottocasa risalta nella sua bellezza matronale, resa viva e palpitante dall'intensa dolcezza dello sguardo e dalla vibrante stesura dell'abito di velluto scuro, rischiarato dai pizzi. Fa da sfondo una mobilissima quinta vegetale, resa con un fitto sovrapporsi di diversi toni scuri di verde e azzurro. Vincitore alla Pinacoteca di Brera nel 1874 del premio Principe Umberto, il dipinto fu poi esposto all'Esposizione Universale di Parigi del 1878.",,,,,,,,,,,,,,,,,20871,Vimercate,MB,,"Via Vittorio Emanuele II, 53 20871 MB",,,http://www.bellalombardia.regione.lombardia.it/LBL/medium/OA-4a020-00005-IMG-0000476076.jpg,,SIRBEC,,,
art,Collezione del Museo Civico Archeologico Giovanni Rambotti,,"Le collezioni del Museo sono tra le più ricche nell'ambito di quelle dedicate ai materiali palafitticoli del Garda occidentale, provenienti sia dagli insediamenti oggi sommersi del lago sia da quelli sepolti nelle torbiere delle colline moreniche che lo circondano. Lungo il percorso sono esposti reperti preistorici e archeologici di corredi tombali, materiali di insediamento e sporadici. Pezzo unico al mondo è l'aratro in legno di quercia, pressoché completo, proveniente dall'insediamento palafitticolo del Lavagnone e risalente all'età del Bronzo (2000 a.C.).",,,,,,,,,,,,,,,,,25015,Desenzano del Garda,BS,,Via Tommaso Dal Molin 7/c 25015 BS,,,http://www.bellalombardia.regione.lombardia.it/LBL/medium/COL-COL-2k050-0000004-IMG-0000001729.jpg,,SIRBEC,,,
art,"Madonna in trono col Bambino, san Michele e san Vincenzo Ferrer",,"La Madonna siede su una sorta di trono costituito dalle rocce di una montagna, parzialmente coperto da un drappo e porge il Bambino a San Vincenzo Ferrer che gli stringe una mano, sul lato sinistro San Michele tiene nella mano destra una bilancia con due anime e con la sinistra brandisce una spada minacciando il demonio che schiaccia sotto i piedi. Uno sprazzo di paesaggio è appena visibile sul lato destro. L'opera riveste grande importanza nella produzione di Camillo per le brillanti soluzioni compositive, gli accordi cromatici e la raffinata eleganza delle figure che nella torsione delle posture e nei colli allungati, risentono dell'influenza della maniera dell'ultimo Parmigianino.Grazie al documento di commissione, rintracciato da Robert Miller nel 1997, è stato possibile ricostruire le vicende legate alla committenza della Madonna in trono col Bambino, san Michele e san Vincenzo Ferrer, realizzata da Camillo Boccaccino tra il 1543 e il 1544. Nel 1518 Giulio Oldoini aveva destinato 300 lire per ornare il sepolcro fatto erigere nella cappella di famiglia, dedicata all'arcangelo Michele, nella chiesa di San Domenico. L'esecutore testamentario, Giorgio Oldoini, muore prima di soddisfare il legato, saranno quindi i suoi eredi, nella persona di Gian Giacomo Oldoini, a commissionare la pala d'altare a Camillo Boccaccino il 30 ottobre 1543, richiedendo che dovesse essere pronta per la Pasqua successiva. I pagamenti attestano che l'opera venne consegnata tra la Pasqua e l'autunno 1544. Appena prima della distruzione della chiesa di San Domenico, verso il 1864-5, la tela subì diversi trasferimenti - nel palazzo di giustizia e in palazzo comunale - finchè pervenne al Museo.",,,,,,,,,,,,,,,,,26100,Cremona,CR,,"Via Ugolani Dati, 4 26100 CR",,,http://www.bellalombardia.regione.lombardia.it/LBL/medium/OA-CR230-00010-IMG-0000478220.jpg,,SIRBEC,,,
art,Busto commemorativo di Girolamo Ghirlanda,,"Tra i molti ritratti presenti all'interno dei Musei Civici di Varese si annovera la scultura dedicata a Girolamo Ghirlanda, che ricoprì per lungo tempo la carica di Presidente del Consiglio della città di Varese ed era legato al territorio del Seprio. L'opera rappresenta una significativa testimonianza di uno dei più dotati scultori del Risorgimento, Vincenzo Vela, che la realizzò nel 1851. A differenza di altre più complesse composizioni scultoree fortemente scenografiche, qui l'artista scelse il formato del busto a erme, che prevede la rappresentazione del soggetto con un taglio alle spalle a tronco di trapezio. Lo sbuffo della cravatta costituisce l'unica nota di movimento nella complessiva rigidità del ritratto nel quale Vela non volle concedersi alcuna frivolezza, riuscendo a condensare nel ritratto il rigore formale del suo stile e la severità morale di Girolamo Ghirlanda.",,,,,,,,,,,,,,,,,21100,Varese,VA,,"Via Cola di Rienzo, 42 21100 VA",,,http://www.bellalombardia.regione.lombardia.it/LBL/medium/OA-1o050-00034-IMG-0000478958.jpg,,SIRBEC,,,
art,,,"Il bel portone ligneo ad arco esposto presso il museo di Tirano è composto da tre scomparti, dei quali quello centrale è un portoncino indipendente. Molto diffusa in ambito valtellinese, questa tipologia di portoni si ritrova in genere a chiusura dei portali di antichi palazzi nobiliari o degli accessi ai loro giardini o cortili. Questo artistico esemplare arricchito di intagli barocchi, databile al XVII secolo, proviene da Grosio e chiudeva l'entrata a una corte affacciata sulla via principale del paese denominata ""Curt de Carlinasc"".",,,,,,,,,,,,,,,,,23037,Tirano,SO,,"Piazza Basilica, 30 23037 SO",,,http://www.bellalombardia.regione.lombardia.it/LBL/medium/BDM-3i010-00218-IMG-0000088962.jpg,,SIRBEC,,,
art,Motivi decorativi floreali,,"La Stanza dei fiori si trova oggi all'interno degli spazi del Monastero di Cairate utilizzati dal Comune, ma il suo uso originario era forse quello di parlatorio personale della badessa. La critica non è riuscita ad identificare la mano dell'artista che l'affrescò, ma la decorazione pittorica può essere datata tra la fine degli anni sessanta e l'inizio degli anni settanta del Quattrocento. L'ambiente costituisce un unicum all'interno del monastero, infatti il soggetto raffigurato è alquanto inusuale: le pareti, lasciate bianche sullo sfondo, sono ornate nella parte centrale da numerose raffigurazioni di fiori e piante, avvolte da un cartiglio, sul quale sono riportate scritte latine in carattere gotico minuscolo, oggi poco leggibili. Le estremità della parete presentano fasce decorative, delle quali quella inferiore raffigura riquadri in finto marmo che celano l'immagine di una sirena a due code e di un ornate, che alcuni critici identificano con il finanziatore della decorazione.",,,,,,,,,,,,,,,,,,Cairate,VA,,Via Molina  VA,,,http://www.bellalombardia.regione.lombardia.it/LBL/medium/OA-3o210-01331-IMG-0000479324.jpg,,SIRBEC,,,
art,,,,,,,,,,,,,,,,,,,,26033,Pescarolo ed Uniti,CR,,"Via Mazzini, 73 26033 CR",,,http://www.bellalombardia.regione.lombardia.it/LBL/medium/BDM-Z0010-00610-IMG-0000088971.jpg,,SIRBEC,,,
art,Terre sur marron foncé,,"Il Museo d'Arte Contemporanea di Lissone raccoglie un folto numero di opere premiate e acquistate durante gli anni del Premio Lissone (1946-1967), palcoscenico internazionale dei maggiori esponenti dell'arte Informale già agli inizi degli anni Cinquanta. All'edizione del 1957 partecipò, ad esempio, anche Antoni Tàpies (1923-2012) con l'opera ""Terre sur marron foncé"" aggiudicandosi uno dei sette ""Premi per la giovane pittura internazionale"", primo dei molti riconoscimenti attribuiti all'artista. L'opera è costruita mediante stratificazioni: secondo una particolare tecnica gestuale e istintiva in cui si alternano colature di tempera e di smalto, paste raggrumate e densi strati di colore, che registrano le impronte stesse dell'artista, i segni delle incisioni a graffito e delle asportazioni operate tramite strumenti di varia natura.Nel lavoro di Tàpies, impostato sulle infinite possibilità espressive della materia e sulla potenza evocativa del segno, vengono impiegati materiali poveri come terre, sabbie e colle, giustapposti fino a raggiungere spessori e profondità diversi, con l'inserzione di oggetti desunti dalla quotidianità. Secondo la sua poetica, infatti, il quadro non rappresenta delle 'cose' ma è una 'cosa', non racconta una 'realtà' bensì diviene esso stesso 'realtà'.",,,,,,,,,,,,,,,,,20851,Lissone,MB,,"Viale Padania, 6 20851 MB",,,http://www.bellalombardia.regione.lombardia.it/LBL/medium/OA-4y090-00004-IMG-0000476125.jpg,,SIRBEC,,,
art,Idolo femminile,,"Le celeberrime figurine cicladiche, in marmo di un'altezza media di 20-30 centimetri, solo eccezionalmente di dimensioni superiori, furono realizzate nel corso del III millennio.. Queste statuette, dapprima estremamente schematizzate, divengono progressivamente più realistiche, con maggiore attenzione ai dettagli anatomici. Rappresentano per lo più un personaggio femminile in piedi, con le braccia incrociate sul petto; l'interpretazione più corrente ne fa idoli della Grande Dea Madre, collocati nella maggior parte dei casi nelle tombe accanto ai defunti, per guidarli nel viaggio ultraterreno. Più difficile è comprendere il significato di altre immagini, come quelle, straordinariamente vivaci, del suonatore di arpa e del suonatore di doppio flauto.",,,,,,,,,,,,,,,,,20123,Milano,MI,,"Corso Magenta, 15 20123 MI",,,http://www.bellalombardia.regione.lombardia.it/LBL/medium/RA-RL480-00007-IMG-0000095430.jpg,,SIRBEC,,,
art,,,"Il campanello sorretto da due colonnine in ottone poggianti su una base circolare in legno, piombo e ottone in strati di diverso spessore, forati al centro, colpito ripetutamente dal batacchio laterale sostenuto da un filo metallico elastico, emette un suono molto vivido. Se si fissa lo strumento sul piatto di una macchina pneumatica e lo si ricopre con una campana di vetro, il suono si indebolisce via via che l'aria si rarefà, fino a scomparire del tutto. Si evidenzia quindi l'impossibilità del suono di propagarsi nel vuoto. Il dispositivo didattico faceva parte del patrimonio del Gabinetto di Fisica di Volta dell'Ateneo pavese. Il laboratorio attivo dal 1771, verrà arricchito dal fisico comasco al suo arrivo in città nel 1778, divenendo uno spazio in cui sperimentare e insegnare quotidianamente agli studenti, ma anche destinato ad esperienze pubbliche che si tenevano due volte la settimana, da dicembre a giugno. Per tale scopo tra il 1785 e il 1788 venne appositamente costruito un nuovo e più ampio Teatro Fisico, l'odierna Aula Volta.",,,,,,,,,,,,,,,,,27100,Pavia,PV,,"Corso Strada Nuova, 65 27100 PV",,,http://www.bellalombardia.regione.lombardia.it/LBL/medium/PST-8e020-00026-IMG-0000043690.jpg,,SIRBEC,,,
art,L'ultimo bacio di Romeo e Giulietta,,"L'ultimo bacio di Romeo e Giulietta fu dipinto da Francesco Hayez a Milano nel 1823. Il soggetto è tratto dalla celebre tragedia di Shakespeare e raffigura l'ultimo bacio scambiato dai due giovani amanti prima che Romeo sia costretto a lasciare la stanza di Giuletta calandosi dalla finestra. Hayez ambienta la scena in un suntuoso palazzo medievale illuminato dalla luce dorata dell'alba, descrivendo con attenzione tutti i particolari degli interni, dagli elementi architettonici agli abiti indossati dai due innamorati. Con questo quadro Hayez si impose come il caposcuola della nascente pittura romantica italiana, proponendo un soggetto letterario allora poco frequentato dagli artisti e una stesura pittorica di grande raffinatezza cromatica, densa di richiami alla grande tradizione veneta del Rinascimento.La tela fu commissionata da Giovan Battista Sommariva, uno dei più importanti collezionisti d'arte europei di primo Ottocento, che la collocò nella sua villa di Tremezzo, dove tuttora si trova.",,,,,,,,,,,,,,,,,22019,Tremezzo,CO,,"Via Regina, 2 22019 CO",,,http://www.bellalombardia.regione.lombardia.it/LBL/medium/OA-CO290-00001-IMG-0000477268.jpg,,SIRBEC,,,
art,Anfore,,"Donata nel 1998 dallo scultore Franz Stähler alla collezione della Fondazione, quest'installazione può essere considerata un'opera ""site-specific"", ovvero appositamente creata per il Parco di sculture di Briosco e scrupolosamente collocata in esso dall'artista stesso, dopo un attento studio dei parametri ambientali circostanti. Molto debitore delle ricerche effettuate nell'ambito della corrente della Land Art, Stähler realizza infatti opere profondamente legate alla terra, utilizzando materiali naturali e primitivi quali il legno, la ceramica, il mattone e il ferro, che vengono modellati direttamente dall'artista. Qui i vasi giganti di terracotta, nell'antichità utilizzati per conservare il cibo, vengono innalzati da terra per mezzo di treppiedi in acciaio alti circa 14 metri, quasi a volersi offrire direttamente al Cielo. Il vaso rappresenta dunque la storia umana, il bisogno dell'uomo di conservare le materie prime per il suo naturale sostentamento, mentre l'altezza conduce ad osservare il mondo e l'ambiente circostante da una diversa prospettiva, che tende sempre meno alla vita quotidiana e sempre più alle grandezze del cosmo.",,,,,,,,,,,,,,,,,20836,Briosco,MB,,"Via Col del Frejus, 3 20836 MB",,,http://www.bellalombardia.regione.lombardia.it/LBL/medium/OA-3o210-01250-IMG-0000475968.jpg,,SIRBEC,,,
art,Giuditta e la sua ancella mettono la testa di Oloferne in un sacco,,"Posti sul parapetto dell'iconostasi, i quattro riquadri a tarsia, coperti da pannelli protettivi che raffigurano composizioni allegoriche in relazione ai contenuti delle ""storie"" da proteggere, introducono alla Bibbia per immagini ideata da Lorenzo Lotto, uno dei principali esponenti del Rinascimento veneziano di primo Cinquecento. Il primo episodio da sinistra, la ""Sommersione del Faraone"", ben si presta a significare simbolicamente l'inizio di un percorso ideato per stimolare meditazioni sulle storie dell'Antico Testamento. Seguono la storia dell'""Arca di Noè"", nella quale si evidenzia il valore purificatore dell'acqua battesiamale, e due scene che simboleggiano il trionfo della virtù sulla brutalità: ""Giuditta con la testa di Oloferne"" e ""Davide e Golia"". I cartoni sono eseguiti dal Lotto tra il 1524 e il 1528. I pannelli, intarsiati dal loverese Giovanni Francesco Capoferri tra il 1527 e il 1530, risultano definitivamente messi in opera entro il 1531. Notevole è la loro resa pittorica: Capoferri, grazie all'utilizzo di diverse essenze lignee, riesce a rendere al meglio le gradazioni cromatiche e i giochi chiaroscurali del Lotto.",,,,,,,,,,,,,,,,,24129,Bergamo,BG,,Piazza Rosate 24129 BG,,,http://www.bellalombardia.regione.lombardia.it/LBL/medium/OA-w6030-00066-IMG-0000475263.jpg,,SIRBEC,,,
art,,,"Nel nostro paese le prime ambulanze a motore degne di nota sono apparse nel 1910, sostituendo a poco a poco le ambulanze a cavallo e le ambulanze a mano, cioè lettighe che i soccorritori a piedi spingevano o tiravano. Ma è con la prima Guerra Mondiale (1914-1918) che l'ambulanza a motore assume una notevole importanza. Inizialmente ricavate da autocarri, già dalla fine degli anni Venti furono allestite partendo da telai automobilistici. L'autoambulanza FIAT 507, conservata presso il Museo, è datata 1929. Il colore beige della carrozzeria rispecchia le specifiche dell'epoca, indicate dalla Croce Rossa Italiana. Nel vano sanitario possiamo notare i particolari più interessanti della vettura: le due barelle a castello con struttura di rinforzo in ferro; il lavandino con rubinetto collegato a un serbatoio, il divano laterale. Altre particolarità: all'esterno sulle fiancate in alto vi sono le prese d'aria laterali per il ricambio dell'aria nel vano sanitario; la portiera utilizzabile per la salita e la discesa della cabina di guida è quella del passeggero a sinistra; sempre in cabina di guida il vetro del parabrezza è diviso in due scomparti che possono essere aperti spingendo in avanti.",,,,,,,,,,,,,,,,,46043,Castiglione delle Stiviere,MN,,"Via Giuseppe Garibaldi, 50 46043 MN",,,http://www.bellalombardia.regione.lombardia.it/LBL/medium/PST-MN020-00001-IMG-0000043671.jpg,,SIRBEC,,,
art,Apostolo,,"La scultura raffigurante un apostolo dalla difficile identificazione custodita presso i Musei Civici di Varese, insieme al suo pendant raffigurante San Giovanni Battista, è stata attribuita allo scultore ticinese Martino Retti, straordinario interprete della scultura lignea tardo rinascimentale attivo soprattutto presso il Sacro Monte di Varese, per il quale realizzò anche la presente scultura. Nonostante la perdita di tutti gli attributi iconografici, che non permette di identificare con precisione l'Apostolo raffigurato, sulla base di confronti con altre statue lignee del medesimo artista la critica ha ipotizzato che l'opera provenga dalla VII cappella del Sacro Monte.",,,,,,,,,,,,,,,,,21100,Varese,VA,,"Via Cola di Rienzo, 42 21100 VA",,,http://www.bellalombardia.regione.lombardia.it/LBL/medium/OA-1o040-00058-IMG-0000478917.jpg,,SIRBEC,,,
art,Collezione d'arte di Gallerie d'Italia,,"Le Gallerie di Piazza Scala si articolano in due aree museali. La sezione ""Da Canova a Boccioni"" presenta le collezioni dell'Ottocento della Fondazione Cariplo e di Intesa Sanpaolo, mentre ""Cantiere del '900"" è un progetto espositivo ""a geometria variabile"" dedicato alle raccolte del XX secolo della Banca. Il percorso permanente, che delinea un panorama generale dell'arte italiana del secondo dopoguerra, è periodicamente integrato da mostre monografiche che approfondiscono singoli autori e temi suggeriti dalla ricchezza di materiali che formano la raccolta.",,,,,,,,,,,,,,,,,,Milano,MI,,"Piazza della Scala, 6  MI",,,http://www.bellalombardia.regione.lombardia.it/LBL/medium/COL-COL-RL480-0000012-IMG-0000001889.jpg,,SIRBEC,,,
art,Madonna con Bambino,,"Pur nella sua semplicità, il dipinto, destinato alla devozione personale, nasconde un'importante significato teologico: il braccialetto di corallo, allusivo del sangue e del martirio, indossato dal Bambino, la sua espressione patetica e l'indefinibile sguardo della Madonna, dal volto di ritratto, prefigurano la Passione e la Morte di Gesù. L'opera è eseguita ""a tempera magra"" su tela finissima che rende i colori opachi ma che dona un aspetto solido e netto alle figure, mentre la lucentezza dei colori è affidata alla preziosità delle materie pittoriche, come il lapislazzuli per il manto e l'oro per la marezzatura della seta. Il dipinto, straordinariamente rifinito, ricorda ancora gli studi su Donatello, compiuti in gioventù da Mantegna a Padova. La naturalezza e la monumentalità con cui è reso il gruppo divino sono i tratti salienti dello stile del Mantegna che traduce in pittura il suo amore per la statuaria classica.",,,,,,,,,,,,,,,,,24121,Bergamo,BG,,"Piazza G. Carrara, 82 24121 BG",,,http://www.bellalombardia.regione.lombardia.it/LBL/medium/OA-C0050-00484-IMG-0000475181.jpg,,SIRBEC,,,
art,"Madonna con Bambino, Apostoli, Santo Vescovo, Santi, Sante con angelo, Angelo, Santa incoronata con Santa monaca, Sant'Eligio benedice un cavallo, Santi Vescovi, San Bassiano con la Vergine, san Giovanni Battista e san Cristoforo, Volta dei bovari, Tetramorfo, Cristo benedicente, Dottori della Chiesa",,"La decorazione ad affresco raffigura nel presbiterio al centro Cristo benedicente racchiuso nella mandorla sorretta dal Tetramorfo, mentre nella fascia inferiore, si dispongono i Santi e al di sotto i dodici Apostoli divisi a gruppi di tre e un Santo Vescovo. Negli intradossi che separano l'abside dal presbiterio compaiono altri due vescovi, due figurine di oranti rivolte verso la navata e due uomini a cavallo sotto la figure del vescovo. Ai lati del presbiterio vi sono dei riquadri con Sant'Eligio che benedice un cavallo, Madonna in trono col Bambino, Santo Vescovo, una Annunciazione affiancata da Santa Caterina e un'altra Santa Martire. La prima volta verso il presbiterio è decorata con carri trainati da coppie di buoi guidati da bovari, quella precedente con i simboli degli Evangelisti e infine i Dottori della Chiesa. Nella navata centrale rimangono una Madonna col Bambino, un'Annunciazione e in controfacciata dei Santi e una sinopia con San Giorgio e la principessa. Sono opera del Maestro di San Bassiano, forse allievo del Maestro della tomba Fissiraga (attivo a Lodi e a Milano), che qui dovrebbe dipingere tra il 14 aprile 1321 e il 1323, come attestano sia i documenti sia la lapide dei Bovari murata nella navata sinistra: ""mccc Paraticum boaterior. xxiii fecit fieri hoc celum"". L'intervento inizia dalle volte per poi proseguire nel presbiterio e delle due absidi, di cui quella a sinistra completamente ridipinta nel 1923-1924.",,,,,,,,,,,,,,,,,26855,Lodi Vecchio,LO,,Via Basilica San Bassiano 26855 LO,,,http://www.bellalombardia.regione.lombardia.it/LBL/medium/OA-T0010-00216-IMG-0000475556.jpg,,SIRBEC,,,
