category,name,nameEN,description,descriptionEN,hours,manager,website,email,phone,fax,weeklyClosing,services,ticketCost,ticketEmail,ticketPhone,ticketHours,ticketReductions,addressStreet,addressLocation,addressCap,addressMunicipalities,addressProvince,addressRegion,addressText,latitude,longitude,photo,accessibility,visibleCopy,sponsor,hidden,unreachable
art,I Tre Crocifissi,,"La piccola opera era probabilmente destinata in origine alla devozione privata, come stimolo e supporto alla preghiera individuale. La struttura architettonica ad arco, simile agli archi di trionfo romani, pare invitare l'osservatore a penetrare nel mistero della Crocifissione di Cristo, fondamentale nel culto cristiano insieme alla Resurrezione. Il dipinto, datato ""1456"" e firmato sul parapetto in primo piano, è la prima opera certa del pittore di origini bresciane Vincenzo Foppa, considerato l'iniziatore della pittura rinascimentale lombarda. L'influsso del Rinascimento toscano è evidente nell'applicazione della prospettiva geometrica, nel plasticismo dei corpi appesi sulle croci e nell'espressività dei volti e dei gesti, accentuata dal luminismo vibrante. Questo aggiornamento è possibile grazie ai probabili studi del giovane Foppa sull'Altare del Santo di Donatello a Padova. Il tracciato prospettico inciso sulla superficie del dipinto conferma questa attitudine 'fiorentina' che viene tuttavia smorzata nel favoloso paesaggio sullo sfondo, di cultura ancora tardogotica.",,,,,,,,,,,,,,,,,24121,Bergamo,BG,,"Piazza G. Carrara, 82 24121 BG",,,http://www.bellalombardia.regione.lombardia.it/LBL/medium/OA-C0050-00030-IMG-0000475176.jpg,,SIRBEC,,,
art,Camera dei Venti,,"Il nome della Camera deriva dalla presenza di visi dalle gote gonfie, personificazioni dei Venti che soffiano tutt'attorno la stanza. Il tema della decorazione, caro alla cultura rinascimentale, è indicato dall'iscrizione in latino sulla porta che immette nell'attigua camera delle Aquile: DISTANT ENIM QVAE SYDERA TE EXCIPIANT. La frase è tratta da una satira di Giovenale e dichiara la dipendenza che lega l'uomo al segno zodiacale sotto cui è nato. Le attività degli uomini sono differenti secondo che essi nascano sotto queste o quelle stelle, fauste o infauste. I sedici medaglioni distribuiti sulle pareti e sovrastati dai Venti sono, infatti, veri oroscopi figurati che mostrano quanto le azioni umane siano determinate dalle sfere celesti. Ad esempio i nati sotto lo Scorpione, in congiunzione con la costellazione Ara, saranno sacerdoti, mentre in congiunzione con Centauro, saranno maestri nell'allevare i cavalli, così come è spiegato in due tondi raffiguranti un sacrificio e un cocchio guidato da cavalli. Questa rappresentazione potrebbe anche alludere alla passione dei Gonzaga per i purosangue. Probabilmente alla base del complesso programma iconografico derivante dai testi classici vi è l'astrologo napoletano Luca Gaurico, i cui servigi erano stati richiesti da Federico II, o l'umanista e astrologo mantovano Paride Ceresara.",,,,,,,,,,,,,,,,,46100,Mantova,MN,,"Viale Te, 13 46100 MN",,,http://www.bellalombardia.regione.lombardia.it/LBL/medium/OA-MN020-00068-IMG-0000479592.jpg,,SIRBEC,,,
art,Ritratto di Sabba Castiglioni,,"Il dipinto ad olio su tela appartiene alla galleria dei ritratti di Palazzo Branda, costituitasi nei secoli grazie alla radicata abitudine dei Castiglioni di conservare immagini dei membri più rappresentativi del casato, e di esporle durante i giorni di festa davanti al Palazzo. L'uomo qui ritratto è il cavaliere gerosolimitano Sabba da Castiglione, noto anche per essere autore dell'opera letteraria ""Ricordi"", pubblicata per la prima volta nel 1545 e dedicata al pronipote Bartolomeo, suo successore nel ruolo di commendatario faentino dal 1544. Fu proprio il nipote a commissionare il ritratto di profilo dello zio, come pendant del proprio, prendendo come modello l'affresco realizzato nell'abside della Chiesa della Commenda di Faenza realizzato da Gerolamo da Treviso nel 1533.",,,,,,,,,,,,,,,,,21043,Castiglione Olona,VA,,"Piazza G. Garibaldi, 1 21043 VA",,,http://www.bellalombardia.regione.lombardia.it/LBL/medium/OA-3o210-01313-IMG-0000479071.jpg,,SIRBEC,,,
art,Deposizione di Cristo dalla croce con vescovo,,"Donate dall'autore al vescovo di Bergamo Adriano Bernareggi, le tre medaglie sono realizzate nel 1948 da Giacomo Manzù, uno dei grandi scultori del Novecento. La scelta di trattare un tema sacro ad alto contenuto drammatico come quello della ""Passione di Cristo"", deriva dalla volontà di denunciare gli orrori della Seconda Guerra Mondiale, facendo diventare il racconto evangelico uno schema meditativo sulla condizione umana. Manzù attualizza i soggetti sacri inserendovi oggetti e personaggi ripresi dal mondo contemporaneo, come la sedia-trono nel Cristo deriso e la figura di vescovo modernamente abbigliato , presente sia ai piedi della croce nella ""Deposizione"" sia di fronte al corpo di Cristo morto nella ""Pietà"". Le opere, che si collocano in un particolare momento di maturazione del linguaggio dell'artista, evidenziano il passaggio da un modellato morbido a forme energicamente definite da pochi e profondi solchi.",,,,,,,,,,,,,,,,,24121,Bergamo,BG,,"Via Pignolo, 76 24121 BG",,,http://www.bellalombardia.regione.lombardia.it/LBL/medium/OA-BG150-00011-IMG-0000475387.jpg,,SIRBEC,,,
art,Sipario - Da appunti di guerra,,"Il dipinto, eseguito da Salvatore Lovaglio nel 2003, si inserisce nel ciclo pittorico ""Appunti di guerra"" e rappresenta un significativo esempio di risposta dell'arte contemporanea al tema della guerra nei Balcani e del dramma del conflitto del Kossovo. La drammaticità del dipinto è evidenziata dalla contrapposizione di bianchi e bruni, che richiamano alla memoria le ceneri, le ombre e le sagome degli uomini in conflitto. L'opera, vincitrice del Premio Acquisto nel 2004, è stata realizzata con una tavolozza cromatica volutamente limitata che gioca sulle sfumature dei bianchi e dei neri con poche pennellate violente e, solo in alcuni punti, ampie.La tela ha un impianto quasi quadrato, in cui gran parte dello spazio è occupato dalla massa scura che incombe sul'osservatore, che sembra destinata a fagocitare la luce del dipinto, quasi come presagio di morte.",,,,,,,,,,,,,,,,,21052,Busto Arsizio,VA,,"Piazza Vittorio Emanuele II, 2 21052 VA",,,http://www.bellalombardia.regione.lombardia.it/LBL/medium/OA-7x010-00101-IMG-0000479427.jpg,,SIRBEC,,,
art,,,"Telai simili a quello esposto presso il Museo Etnografico Tiranese sono ancora in uso in tutta la provincia di Sondrio, utilizzati per la produzione dei ""pezzotti"", i tipici tappeti realizzati con strisce di stoffa. Questo esemplare, di tipologia tradizionale e interamente costruito in legno, proviene da Tovo di Sant'Agata e venne realizzato intorno alla fine dell'Ottocento.",,,,,,,,,,,,,,,,,23037,Tirano,SO,,"Piazza Basilica, 30 23037 SO",,,http://www.bellalombardia.regione.lombardia.it/LBL/medium/BDM-3i010-00443-IMG-0000088958.jpg,,SIRBEC,,,
art,Portale minore sinistro di S. Stefano,,"Il portale in arenaria con inserti in calcare ed esuberante corredo scultoreo, proviene dalla perduta cattedrale romanica di S. Stefano. La stratificazione di piani con rigoglioso partito decorativo, a palmette, tralci ondulati, motivi fitomorfi, nastri intrecciati, girali, lotte tra mostri, figure zoomorfe e umane costituisce la caratteristica distintiva e peculiare dei portali pavesi tra XI e XII secolo. Questo, formato da ben cinque ghiere riccamente decorate, reca nella lunetta un arcangelo aureolato, con i simboli del potere, scettro e globo, che ha il compito di purificare e redimere il fedele prima di accedere all'interno sacro. Ai lati due raffigurazioni simmetriche, con un calice nel quale si abbeverano due colombe e dal quale nasce l'albero della vita. Sono motivi del repertorio scultoreo di origine tardo antica e altomedievale, ma derivati anche da tessuti orientali. Il lessico decorativo antico viene qui riformulato e modernizzato, con la ricerca della varietà con esiti quasi di sapore astratto. I decori, apparentemente distribuiti in modo casuale, rivelano un'attenzione compositiva e una studiata ricercatezza formale. Infine, l'alternanza di calcare e arenaria, non consueta in ambito pavese, conferisce un ulteriore arricchimento cromatico.",,,,,,,,,,,,,,,,,27100,Pavia,PV,,"Castello Visconteo, Viale XI Febbraio, 35 27100 PV",,,http://www.bellalombardia.regione.lombardia.it/LBL/medium/OA-PV300-00009-IMG-0000476535.jpg,,SIRBEC,,,
art,Divinità marine,,"Questo tipo di recipiente, un profondo bacile con tre grandi lobi, era denominato nel Rinascimento ""infrescatoio"" e, per la presenza prevalente di decori con soggetti marini, si ritiene fosse destinato a contenere acqua fredda per rinfrescare le bottiglie di vino. La scena dipinta all'interno del rinfrescatoio di Milano, con ninfe, tritoni e putti alati, pare ispirata dal dipinto di Raffaello, ""Galatea"", realizzato per Villa Medici a Roma. Per la somiglianza con numerosi altri rinfrescatoi di fattura simile l'oggetto è attribuito alla Bottega di Orazio Fontana, maestro di maioliche attivo a Urbino nel XVI secolo.",,,,,,,,,,,,,,,,,20121,Milano,MI,,Piazza Castello 20121 MI,,,http://www.bellalombardia.regione.lombardia.it/LBL/medium/OA-RL480-00006-IMG-0000477556.jpg,,SIRBEC,,,
art,Cristo alla colonna,,"Bramante si era formato a Urbino, centro di studi matematici dove era maturato l'uso della prospettiva come forma di controllato ordinamento dello spazio dipinto. Giunto a Milano, l'artista approfondì queste conoscenze ricercando effetti visivi e illusionistici destinati a colpire le emozioni dello spettatore: il Cristo alla colonna può considerarsi un manifesto di tale innovativo linguaggio, grazie al quale la cultura artistica lombarda si aprì a inedite soluzioni di stampo rinascimentale. L'idea di uno spazio ricreato illusionisticamente - già indagata nel coro di S. Maria presso San Satiro - costituisce il tema portante del dipinto di Brera, dove studiati espedienti compositivi riescono a suggerire l'esistenza di un ambiente sorretto da colonne entro il quale si svolge il supplizio di Cristo.Sollecitò la sensibilità di Bramante il confronto con le opere di Leonardo, che a Milano negli stessi anni, dipingeva il Cenacolo e indagava le potenzialità espressive dei movimenti del corpo e delle espressioni del viso: nel Cristo alla colonna la plasticità scultorea di matrice urbinate si arricchisce pertanto di dettagli di sorprendente naturalismo, quali le carni strette dai lacci e le lacrime trasparenti, i cui effetti sull'emotività dello spettatore costituivano un'assoluta novità rispetto alla formazione di Bramante. L'opera è stata probabilmente eseguita nei primi anni novanta del Quattrocento.",,,,,,,,,,,,,,,,,20121,Milano,MI,,"Via Brera, 28 20121 MI",,,http://www.bellalombardia.regione.lombardia.it/LBL/medium/OA-RL480-00056-IMG-0000477378.jpg,,SIRBEC,,,
art,,,"Il genicrino ponderale è una bilancia modificata per determinare il sesso delle crisalidi contenute nei bozzoli semplicemente pesando questi ultimi integri: (""genicrino"" = determinazione di genere). Dopo la scoperta del ""metodo Pasteur"" per proteggere i bachi (Bombyx mori) dalle infezioni da pebrina e altro, si svilupparono molto gli incroci tra varie razze di bachi. Occorreva quindi tenere divise le farfalle femmine dai maschi prima della nascita per evitare accoppiamenti non voluti. Uno dei vari metodi adottati consisteva nel rilevare per ogni partita di bachi il peso medio dei bozzoli dei maschi e quello delle femmine. Questi ultimi sono più pesanti per via delle uova presenti. Tarata la bilancia, si pesa un bozzolo per volta, individuando così il sesso della crisalide contenuta. Se si opera con attenzione l'errore è molto basso. Questo genicrino ponderale compare verso il 1890 - reca inciso ""Genicrino bergamasco - Brevettato G.Malacrida - Bergamo.",,,,,,,,,,,,,,,,,23852,Garlate,LC,,"Via Statale, 490 23852 LC",,,http://www.bellalombardia.regione.lombardia.it/LBL/medium/PST-4n030-00002-IMG-0000043670.jpg,,SIRBEC,,,
art,"Cristo crocifisso con santa Maria Maddalena, Dio Padre, Madonna annunciata, Angelo annunciante, Tentazione e caduta di Adamo e Eva, San Giovanni Evangelista, Cristo in gloria, Agnus Dei, Madonna",,"La decorazione pittorica di questa croce è densa di significati simbolici, che intendono comunicare al fedele il senso della redenzione (la ""Redemptio Nova"" scritta a tergo) e della salvezza profuse a tutti gli uomini mediante il sacrificio di Cristo. Le sofferenze e la morte di Gesù, agnello sacrificale, si trasformano in vita e lavano i peccati dell'umanità, a cui allude esplicitamente la scena con Adamo ed Eva ai lati dell'albero del bene e del male, presente sul retro. Dipinta da entrambi i lati per essere vista da diverse posizioni, la croce è, infatti, posta in origine al centro dell'antica chiesa di S. Maria ed è forse utilizzata anche nei riti processionali. La tipologia ancora trecentesca della croce con terminazioni trilobate suggerisce una datazione non dopo la prima metà del secolo XV, forse subito dopo la fondazione della chiesa nel 1421 o dopo la consacrazione nel 1430.",,,,,,,,,,,,,,,,,24024,Gandino,BG,,Piazza Emancipazione 24024 BG,,,http://www.bellalombardia.regione.lombardia.it/LBL/medium/OA-BG140-00006-IMG-0000475316.jpg,,SIRBEC,,,
art,grifo,,"Come tutte le pitture parietali venute alla luce dallo scavo della casa del Ninfeo, anche questo frammento di affresco mostra una altissima qualità, sia esecutiva che tecnica. Esso raffigura un grifo, un animale mitologico con ali e testa d'uccello. Proveniente dagli scavi di piazza Marconi, ornava le pareti di una stanza della casa del Ninfeo, così detta dalla momumentale fontana che ne abbelliva il giardino. Lo scavo della casa ha messo in luce un consistente strato di bruciato, testimonianza dell'incendio del 69 d.C., quando Cremona viene messa a ferro e a fuoco dalle truppe del futuro imperatore Vespasiano. L'alta qualità dell'opera testimonia l'elevata condizione sociale del padrone di casa, nel quale è stato proposto di riconoscere un personaggio di rango sanatorio. Ritrovato dopo quasi 2000 anni dal tragico evento, è ora esposto per la prima volta al Museo Archeologico San Lorenzo.",,,,,,,,,,,,,,,,,26100,Cremona,CR,,"Via S. Lorenzo, 4 26100 CR",,,http://www.bellalombardia.regione.lombardia.it/LBL/medium/RA-CR210-00008-IMG-0000095458.jpg,,SIRBEC,,,
art,Adorazione dei Re Magi,,"Realizzati tra il 1583 e il 1586 con l'intento di dotare la Basilica di Santa Maria Maggiore di arazzi destinati ad ornare l'edificio nelle occasioni solenni, questi splendidi manufatti appartengono alla serie convenzionalmente detta ""fiorentina"". Raffigurano nove episodi sacri che raccontano i Misteri di Maria e l'Infanzia di Gesù. In ogni scena sacra ricorrono vasi o canestri colmi di frutta a significare il grembo virginale della Madonna, simbolo di floridezza. Questo senso di abbondanza rigogliosa è rimarcato dalle splendie cornici colme di frutti, fiori, putti e busti femminili che circondano ogni singola scena. Nei medaglioni posti lungo le fasce laterali e verticali sono raffigurate scene che sottolineano il significato sacro e simbolico dell'evento principale. I cartoni sono eseguiti dal pittore fiorentino Alessandro Allori e dalla sua bottega mentre la tessitura fu realizzata dall'Arazzeria Medicea con a capo Benedetto Squilli di Michele.",,,,,,,,,,,,,,,,,24129,Bergamo,BG,,Piazza Rosate 24129 BG,,,http://www.bellalombardia.regione.lombardia.it/LBL/medium/OA-w6010-00368-IMG-0000475234.jpg,,SIRBEC,,,
art,,,"La lapide con iscrizione celebrativa era murata sul pilone centrale di Porta Romana. La Porta costituiva il primo, e più rappresentativo, degli ingressi eretti nella cinta difensiva di Milano. La costruzione delle mura era iniziata nel 1171, a quattro anni dal rientro dei milanesi dall'esilio decretato da Federico Barbarossa, dopo l'assedio e la distruzione del centro del 1162. Nella lapide l'iscrizione ricorda i consoli che rievocavano il rientro dei milanesi in città, avvenuto il 5 maggio 1167, e ne celebravano la rinascita con la costruzione della porta, cominciata nel marzo 1171. La Porta sopravvive fino al 1793, quando viene abbattuta per essere sostituita da un edificio progettato da Leopoldo Pollack sul quale vengono murati i rilievi superstiti di due dei tre piloni, fino al loro trasferimento al Castello, nel 1895.",,,,,,,,,,,,,,,,,20121,Milano,MI,,Piazza Castello 20121 MI,,,http://www.bellalombardia.regione.lombardia.it/LBL/medium/OA-RL480-00011-IMG-0000477476.jpg,,SIRBEC,,,
art,Altare di S. Rita,,"L'abside minore destra rappresenta un punto di forte richiamo per molti fedeli, perché custodisce l'altare con la reliquia di S. Rita da Cascia. L'altare marmoreo a bassorilievo si compone di un paliotto raffigurante la ""Miracolosa entrata di S. Rita nel convento delle Agostiniane di S. Maria Maddalena a Cascia, accompagnata dai Santi Agostino, Nicolò da Tolentino e Giovanni Battista Giovanni"", sul quale si imposta l'alta pala scandita da undici riquadri figurativi che raccontano con uno stile semplice e sobrio la vita della Santa. Sopra il tabernacolo, disposto al centro, si inserisce l'emblema agostiniano: il libro aperto con il cuore di Gesù fiammeggiante sormontato da una croce e dai simboli episcopali con il motto ""Prendi e leggi"" (dalle Confessioni di S. Agostino). L'altare viene realizzato nel 1939 dallo scultore pavese Giovanni Scapolla, allievo del grande maestro Adolfo Wildt, su progetto dell'architetto Emilio Carlo Aschieri. Il quadretto policromo al centro del pittore romano Tito Troja, raffigura ""S. Rita in estasi che riceve da Cristo crocifisso la spina sulla fronte"".",,,,,,,,,,,,,,,,,27100,Pavia,PV,,Piazza San Pietro in Ciel d'Oro 27100 PV,,,http://www.bellalombardia.regione.lombardia.it/LBL/medium/OA-PV300-00011-IMG-0000476546.jpg,,SIRBEC,,,
art,Trionfo della Croce,,"Il dipinto murale, collocato al centro della volta, raffigura il Trionfo della Croce, sollevata verso i cieli da un gruppo di angeli e accolta dalla Trinità. L'opera fu realizzata dal pittore milanese Andrea Lanzani tra 1686 e 1688 e si inserisce nel radicale rinnovamento della decorazione interna di Santa Cecilia attuato negli ultimi decenni del Seicento. In pochi anni la chiesa si trasformò in uno dei complessi decorativi più importanti del tardo barocco lombardo, assumendo la veste che ancora oggi conserva, caratterizzata da un raffinato dialogo tra pittura e scultura in stucco. Lanzani era uno dei maggiori artisti attivi in Lombardia e nel Trionfo della Croce mette in opera una composizione leggibile e razionale, che mostra il suo aggiornamento sulla pittura romana contemporanea. A ciò si associa una gamma cromatica vivace e luminosa che anticipa la pittura del Settecento e garantisce al pittore un ruolo di primo piano nel passaggio dell'arte lombarda verso il nuovo secolo.",,,,,,,,,,,,,,,,,22100,Como,CO,,"Via Cesare Cantù, 57 22100 CO",,,http://www.bellalombardia.regione.lombardia.it/LBL/medium/OA-CO290-00018-IMG-0000477285.jpg,,SIRBEC,,,
art,Mesi di Novembre e Dicembre,,"La scultura, attribuita alla mano stessa di Wiligelmo, con tutta probabilità proviene da un portale anticamente presente nella Chiesa abbaziale di San Benedetto Po. Che si tratti del maestro o di un artista che ha fatto sua questa scuola, sembra che l'esecuzione dei pezzi sia da collocare dopo il secondo decennio del XII ed entro il 1130.Il frammento di marmo greco è stato scolpito con le personificazioni di due mesi: Novembre e Dicembre. Due figure maschili impegnate in attività lavorative peculiari sono poste all'interno di edicole, sormontate da iscrizioni in latino che le identificano. NO|VEM|BER è il personaggio inferiore, occupato a spargere le sementi tenute raccolte in un lembo della tunica. [DI]|CEM|BER è il personaggio superiore, che spacca la legna per l'inverno.",,,,,,,,,,,,,,,,,46027,San Benedetto Po,MN,,"Piazza Teofilo Folengo, 22 46027 MN",,,http://www.bellalombardia.regione.lombardia.it/LBL/medium/OA-MN020-00058-IMG-0000474883.jpg,,SIRBEC,,,
art,,,,,,,,,,,,,,,,,,,,26013,Crema,CR,,"Piazzetta Winifred Terni De Gregory, 5 26013 CR",,,http://www.bellalombardia.regione.lombardia.it/LBL/medium/BDM-CR240-00006-IMG-0000088982.jpg,,SIRBEC,,,
art,Pala Cesi,,"La pala d'altare presenta una grandiosa architettura sullo sfondo e ai lati due setti murari che racchiudono l'alto basamento su cui siedono la Madonna con il Bambino. Ai piedi delle sacre figure San Giovanni Battista bambino, a sinistra San Pietro con le chiavi del paradiso presenta il committente alla Vergine, mentre a destra San Paolo si riconosce per la spada e il libro. Alle spalle, quali chiusure della composizione, due santi Vescovi con pastorale a ricciolo, non identificabili. I documenti sembrano concorrere a identificare il personaggio inginocchiato in Federico Cesi che nel 1541 operò una ristrutturazione dell'abbazia ed è in quella occasione che commissiona l'opera a Callisto.",,,,,,,,,,,,,,,,,26834,Abbadia Cerreto,LO,,"Piazza della Vittoria, 1 26834 LO",,,http://www.bellalombardia.regione.lombardia.it/LBL/medium/OA-T0010-00218-IMG-0000475592.jpg,,SIRBEC,,,
art,,,,,,,,,,,,,,,,,,,,26029,Soncino,CR,,"Via Lanfranco, 8 26029 CR",,,http://www.bellalombardia.regione.lombardia.it/LBL/medium/BDM-CR240-00001-IMG-0000088976.jpg,,SIRBEC,,,
art,Signora in bianco,,"L'opera, eseguita da Emilio Magistretti nel 1906, costituisce un interessante ritratto di signora e appartiene a una serie di dieci tele che il pittore regalò nel 1927 alla Società Bustese di Storia e di Arte. Si ipotizza che il dipinto sia stato presentato dall'artista all'Esposizione Internazionale di Milano del 1906, antesignano dell'EXPO del 2015. Il taglio dell'opera ricorda gli esiti della pittura di Giacomo Grosso e stupisce chi guarda la tela per l'atteggiamento e lo sguardo della donna ritratta, che guarda l'osservatore consapevole del suo fascino. La luce è impiegata dal pittore per esaltare gli effetti cangianti dell'abito della dama, avvolta da un boa bianco che ne incornicia le spalle e il volto. La cura del dettaglio è evidente nella riproduzione di una poltrona Thonet, che con le sue linee sinuose e morbide fa da contrappunto alle forme della donna.",,,,,,,,,,,,,,,,,21052,Busto Arsizio,VA,,"Piazza Vittorio Emanuele II, 2 21052 VA",,,http://www.bellalombardia.regione.lombardia.it/LBL/medium/OA-7x010-00062-IMG-0000479424.jpg,,SIRBEC,,,
art,Scultura n. 15,,"Inscrivibile in un quadrato, le cui dimensioni si ricavano dalla base e dall'altezza degli elementi, la scultura si articola sulla ripetizione in verticale di un modulo rettangolare a sezione ricurva, con la variazione dl primo elemento da sinistra che, per mezzo di un semplice scarto in diagonale, vivacizza e complica la composizione. La ricerca di Fausto Melotti tende ad articolare lo spazio in forme proporzionate e musicali. ""Scultura n. 15"" entra nelle collezioni civiche milanesi nel 1979 quando, all'indomani della mostra antologica di Palazzo Reale a Milano, lo scultore decide di donare le dieci prove d'artista, realizzate nel 1968, di altrettante sculture risalenti al biennio 1934-1935 sopravvissute ai bombardamenti di Milano del 1943. L'opera originale si trova nella Galleria Civica d'Arte Moderna e Contemporanea di Torino.",,,,,,,,,,,,,,,,,20121,Milano,MI,,Piazza Duomo 20121 MI,,,http://www.bellalombardia.regione.lombardia.it/LBL/medium/OA-RL480-00080-IMG-0000479773.jpg,,SIRBEC,,,
art,Sant'Antonio da Padova incontra Ezzelino da Romano,,"Il pittore cremonese Malosso rivela nella scelta del soggetto e nell'uso dei colori una vicinanza ai dettami della Controriforma. Sono evidenti, però, anche i debiti verso la cultura cremonese del Pordenone con le Storie della Passione nel duomo di Cremona e di Antonio Campi. La scelta di raffigurare Sant'Antonio da Padova si collega al nome di Antonio Fissiraga, per l'importanza che ebbe nella realizzazione e decorazione della chiesa. Il grande dipinto raffigura l'incontro avvenuto nel 1231 tra Sant'Antonio da Padova e il tiranno Ezzelino da Romano a Verona, dove il santo si era recato per chiedere la liberazione di alcuni vcavalieri gulefi. Rimproverato da Antonio per la sua crudeltà, si gettò ai suoi piedi miracolosamente convertito, proprio come narra l'iscrizione in latino in basso al centro. Sullo sfondo l'artista dipinge l'arco di trionfo della città scaligera, distrutto nel 1805. All'arco romano ""dei Gavi"" fa riferimento l'iscrizione sul basamento dello stesso.",,,,,,,,,,,,,,,,,26900,Lodi,LO,,Piazza Ospitale 26900 LO,,,http://www.bellalombardia.regione.lombardia.it/LBL/medium/OA-T0010-00225-IMG-0000475647.jpg,,SIRBEC,,,
