category,name,nameEN,description,descriptionEN,hours,manager,website,email,phone,fax,weeklyClosing,services,ticketCost,ticketEmail,ticketPhone,ticketHours,ticketReductions,addressStreet,addressLocation,addressCap,addressMunicipalities,addressProvince,addressRegion,addressText,latitude,longitude,photo,accessibility,visibleCopy,sponsor,hidden,unreachable
art,Statuetta fittile di vignaiolo,,"Il raffinato manufatto fittile rappresenta una scena di vita quotidiana: un vignaiolo a figura intera reso realisticamente con abbigliamento roncola in una mano e un grappolo d'uva nell'altra. Rinvenuto nel 1978, proviene da una tomba della necropoli di Gropello Cairoli in località Marone, area che ha restituito numerose testimonianze. In Lomellina nei corredi funebri di tombe di età romana, accanto a manufatti d'uso corrente si rinvengono varie tipologie di statuette: generalmente personaggi di genere a figura intera, raro il busto, intenti nelle occupazioni quotidiane o figure divine o mitologiche o animali. Non è sempre chiaro il significato di tali manufatti all'interno della tomba, sicuramente costituivano per il defunto un legame simbolico con il mondo terreno in riferimento alla vita quotidiana o ai culti praticati. Le terrecotte figurate realizzata a stampo, da matrice bivalve, con ritocchi a stecca, sono peculiari della Lomellina, con limitata diffusione in Piemonte, nel Verbano e nel Canton Ticino. Il ristretto ambito di diffusione fa presumere l'esistenza di centri di produzione locale, attivi tra l'età augustea e la metà del I sec. d.C.",,,,,,,,,,,,,,,,,27029,Vigevano,PV,,"Castello Visconteo Sforzesco, Piazza Ducale 20; Corso della Repubblica 27029 PV",,,http://www.bellalombardia.regione.lombardia.it/LBL/medium/RA-PV300-00006-IMG-0000091411.jpg,,SIRBEC,,,
art,Collezione del Museo Archeologico San Lorenzo,,"La collezione del Museo Archeologico San Lorenzo è composta da una ricchissima varietà di materiali provenienti in massima parte dalla città di Cremona e risalenti all'età romana. Il primo nucleo comincia a formarsi già nell'Ottocento, grazie a scavi o ritrovamenti casuali. Prima dell'apertura del Museo, la collezione era ospitata al piano terreno del Museo Civico ""Ala Ponzone"", allestito nella prestigiosa sede di palazzo Affaitati. Nel 1993, i locali, i cui muri sono intaccati da una grave umidità, vengono sgomberati per una ristrutturazione che dovrebbe essere a breve termine. Ma un progetto più ambizioso ha già preso piede: recuperare la splendida basilica romanica di San Lorenzo, che versa in condizioni di grave degrado, e costituire un museo archeologico interamente dedicato alla città. Il progetto sarà portato a compimento nel 2009. Nel nuovo museo, accanto ai reperti di più antica acquisizione, vengono esposti per la prima volta anche i materiali emersi dagli scavi di piazza Marconi, che arricchiscono il patrimonio della collezione con una quantità eccezionale di reperti unici e preziosi.",,,,,,,,,,,,,,,,,26100,Cremona,CR,,"Via S. Lorenzo, 4 26100 CR",,,http://www.bellalombardia.regione.lombardia.it/LBL/medium/COL-COL-CR210-0000002-IMG-0000001927.jpg,,SIRBEC,,,
art,La Dogana,,"Intorno al 1824 Friedrich Lose elaborò per l'editore milanese Francesco Bernucca il volume ""Viaggio pittorico e storico al Monte Spluga"", il museo di Campodolcino espone la rara e raffinata serie di stampe che componeva l'album. Le 16 tavole presentano vedute dell'itinerario della via dello Spluga, lungo la strada carrozzabile voluta dal governo austriaco inaugurata nel 1822. Il ""viaggio pittorico"" o ""viaggio pittoresco"" era un tipo di pubblicazione molto diffuso nella prima metà dell'Ottocento, a metà strada tra la guida turistica e il libro d'arte. I volumi erano costituiti da numerose tavole incise accompagnate da un commento descrittivo, le immagini illustravano vedute e panorami del percorso.",,,,,,,,,,,,,,,,,23021,Campodolcino,SO,,"Piazza S. Antonio, 15 23021 SO",,,http://www.bellalombardia.regione.lombardia.it/LBL/medium/S-SO100-00007-IMG-0000152047.jpg,,SIRBEC,,,
art,,,"Questo splendido tappeto presenta il tradizionale impianto a medaglione con quattro motivi angolari posti su un campo a fondo blu scuro. Il medaglione ha sedici punte con pendenti, è a fondo rosso con una complessa decorazione a uccelli e fasce di nubi, un motivo curvilineo di origine cinese, collegati da una fitta grata fiorita. Al centro del medaglione si trova una iscrizione: ""Per le fatiche di Ghyas el Din Jami quest'opera rinomata fu condotta a sì splendido compimento nell'anno 949"". Il 949, Anno dell'Egira, corrisponde al 1542-1543 d.C.. Nel campo blu sono raffigurate varie scene di caccia, uomini a cavallo con l'arco, animali selvatici e fantastici, uccelli. Si tratta della rappresentazione simbolica del giardino dell'Eden: gli animali in lotta rappresentano l'eterno combattimento tra vizio e virtù, i principi a caccia alludono invece alla ricerca di un'elevazione spirituale. Il tappeto è costituito da vari frammenti ricomposti e le parti mancanti sono state tessute a punto arazzo. Un frammento della bordura è stato recentemente donato da un generoso collezionista, Alessandro Bruschettini, e, dopo il restauro, è tornato a far parte del tappeto.",,,,,,,,,,,,,,,,,20121,Milano,MI,,"Via Manzoni, 12 20121 MI",,,http://www.bellalombardia.regione.lombardia.it/LBL/medium/OA-RL480-00045-IMG-0000477436.jpg,,SIRBEC,,,
art,L'urto,,"L'opera pittorica, realizzata da Emilio Vedova nel 1950, è caratterizzata da forme geometriche (triangoli, rettangoli, semicerchi, poligoni irregolari) e da una cromia fredda e piatta (grigio, nero, bianco). Questa è ascrivibile all'Astrattismo ed al Concretismo italiano, che riscosse un buon successo di critica e di pubblico in tutta Europa. In particolare quest'opera afferisce ed è rappresentativa della serie denominata delle ""Geometrie nere"", realizzata tra il 1946 e il 1950. Il dipinto, infatti, tratta il tema della violenza, evidente richiamo alla drammaticità del periodo bellico appena concluso. Grazie alla costruzione astratta di figure disposte in modo vorticoso intorno ad assi obliqui, il tema della Grande Guerra diviene ancor più vorticosamente e astrattamente raccontato. L'opera acquista, dunque, una forte valenza di denuncia politica dal forte impatto sociale. Il dipinto dimostra il forte impegno contro la guerra e la dittatura profuso da Vedova che, insieme ad altri numerosi artisti italiani, aveva combattuto per la liberazione della patria successivamente riunendosi sotto il nome di Fronte Nuovo delle Arti. Fu questo un impegno costante per Vedova che certamente costituisce un maestro indiscusso della pittura informale europea.",,,,,,,,,,,,,,,,,21013,Gallarate,VA,,"Via De Magri, 1 21013 VA",,,http://www.bellalombardia.regione.lombardia.it/LBL/medium/OA-A0020-00018-IMG-0000479358.jpg,,SIRBEC,,,
art,Le Muse,,"Nel 1997 nel corso di lavori di restauro al castello viene scoperto un ciclo affrescato di notevole qualità attribuito a Bartolomeo Suardi detto il Bramantino, uno dei pittori più raffinati del XVI secolo. Gli affreschi frammentari raffigurano le nove Muse, delle quali solo due quasi totalmente integre: Erato, musa della lirica amorosa, con compasso nella mano destra, uno strumento musicale a corde nella sinistra e ai piedi tavole con figure geometriche; Urania, musa dell'astronomia, con ghirlanda di stelle sul capo, volge lo sguardo al cielo che indica la mano destra, mentre nella sinistra tiene la sfera armillare. Le Muse, sedute in trono, sono inserite a circa due metri d'altezza in un colto impianto architettonico trompe l'oeil con suggestive inquadrature, il nome iscritto sopra il capo e, dove sopravvive, un verso celebrativo sulla trabeazione. Difficile l'identificazione del committente, forse il conte di Ligny cui fu affidato il feudo di Voghera tra il 1499 e il 1503, alla caduta del ducato sforzesco e che ebbe documentati rapporti di committenza artistica con Bramantino,",,,,,,,,,,,,,,,,,27058,Voghera,PV,,Piazza Castello 27058 PV,,,http://www.bellalombardia.regione.lombardia.it/LBL/medium/OA-PV300-00025-IMG-0000476610.jpg,,SIRBEC,,,
art,Eracle e figure di divinità,,"L'altare dipinto è una delle rarissime testimonianze di pittura romana di Milano, consistenti per lo più in piccoli frammenti parietali di dimore private. In muratura ricoperta di intonaco dipinto, esso fu rinvenuto in via Circo nel 1925, rappresenta un raro esemplare databile tra la fine del I sec. d.C e gli inizi del II sec. d.C. Sulle pareti intonacate dell'ara parallelepipeda si stagliano le quattro figure incorniciate da larghe fasce rosse ed ornate da festoni vegetali in corrispondenza degli angoli superiori. Sui lati corti sono rappresentate la dea Fortuna/Abundantia e una Vittoria Alata, sui lati lunghi figurano Cerere/Terra, raffigurata semidistesa, ed Ercole. Esso era verosimilmente adibito a uso privato, come suggeriscono i soggetti rappresentati che sono tipici dei larari, tempietti collocati nelle abitazioni private, e vanno interpretati come messaggio di buon augurio, secondo un linguaggio simbolico molto diffuso a partire dall'età augustea (27 a.C.-14 d.C.). Le immagini delle tre dee sono particolarmente riprodotte sulle effigi monetali, mentre Ercole è uno degli dei più popolari del mondo romano, spesso onorato nei larari familiari. La buona qualità della pittura, così come la scelta di soggetti colti, rispecchia la raffinatezza e la cultura del committente del monumento, forse il proprietario di una delle ricche abitazioni che caratterizzano, tra il I e il III secolo d.C., il quartiere occidentale della città antica. L'altare potrebbe aver fatto parte dell'arredo di una ""domus"", ma, considerate le dimensioni, è anche possibile che fosse collocato nella sede di un ""collegium"" o corporazione di artigiani o commercianti.",,,,,,,,,,,,,,,,,20123,Milano,MI,,"Corso Magenta, 15 20123 MI",,,http://www.bellalombardia.regione.lombardia.it/LBL/medium/RA-G0380-00029-IMG-0000095414.jpg,,SIRBEC,,,
art,,,"Alle 8.30 del 24 maggio 2005, Angelo D'Arrigo sorvola per la prima volta l'Everest con questo deltaplano ad ala rigida. È il nuovo record di quota nella categoria volo a vela. Prodotto dalla società italiana Icaro 2000, è dotato di telaio in fibra di carbonio, velatura in fibra di poliestere e componentistica in ergal, lega in alluminio-zinco, per un peso di soli 34 chili.",,,,,,,,,,,,,,,,,20123,Milano,MI,,"Via San Vittore, 21 20123 MI",,,http://www.bellalombardia.regione.lombardia.it/LBL/medium/PST-ST120-00366-IMG-0000043833.jpg,,SIRBEC,,,
art,"San Cristoforo guada il fiume con Gesù Bambino sulle spalle, Sant'Antonio Abate",,"Nel pieno centro storico di Castiglione Olona, a poca distanza di Palazzo Branda, si ergono due veri ""colossi"", come vennero definiti nelle cronache dell'epoca, realizzati con la tecnica scultorea dell'altorilievo. Le due gigantesche figure, poste ai lati del portale d'ingresso della cappella, raffigurano i Santi Antonio abate e Cristoforo e furono realizzate in pietra arenaria da anonimi artisti lombardi, poi chiamati dalla critica ""Maestri caronesi"". Tra gli scultori eletti dal cardinale Branda Castiglioni per condurre il suo progetto di rinnovamento culturale del borgo castiglionese, essi seppero coniugare il repertorio decorativo nord-italico con i nuovi modelli di classicità e monumentalità, importati dal cardinale attraverso l'arrivo nel borgo di artisti e maestranze toscane.",,,,,,,,,,,,,,,,,,Castiglione Olona,VA,,Piazza Garibaldi  VA,,,http://www.bellalombardia.regione.lombardia.it/LBL/medium/OA-3o210-01324-IMG-0000479110.jpg,,SIRBEC,,,
art,,,"Le due lampade ad arco conservate entro una bacheca furono prodotte dalla ditta Siemens & Halske di Berlino nel 1892 quella posta in verticale, dalla Siemens - Schukertwerke G.m.b.H. nel 1903 la grande sfera in vetro. Il primo manufatto proviene dalla Collezione Enel S.p.A. che nel 1999 lo cede al museo pavese con un contratto di comodato, mentre il secondo viene donato nel 2007 dalla Siemens (Collezione dell'Università di Pavia). Ciascuna delle due lampade costituisce un pezzo di eccezionale importanza in quanto rappresenta ciò che precede la lampadina. La lampada ad arco è un dispositivo di illuminazione basato sull'emissione luminosa di un arco voltaico. Si può considerare una particolare forma della lampada a scarica in aria atmosferica, dove in questo caso avviene una vera e propria scarica elettrica. Il primo esperimento di illuminazione elettrica pubblica, giudicato all'epoca un evento eccezionale, avviene nel 1877 in piazza Duomo a Milano, in realtà la tecnologia della lampada ad arco è sperimentata già dal 1853. Milano è quindi la prima città in Europa a disporre di un servizio di illuminazione elettrica regolarmente organizzato.",,,,,,,,,,,,,,,,,27100,Pavia,PV,,"Via Ferrata, 3 27100 PV",,,http://www.bellalombardia.regione.lombardia.it/LBL/medium/PST-PV300-00005-IMG-0000043713.jpg,,SIRBEC,,,
art,Bambina con fiori,,"Il dipinto a olio 'Bambina con fiori' di Giacomo Balla è uno degli esempi più interessanti del periodo prefuturista dell'autore. La sua attività presso lo studio del pittore e fotografo Pietro Paolo Bertieri, assieme all'esperienza parigina tra l'autunno del 1900 e la primavera del 1901, lo portano a soluzioni luministiche e cromatiche inedite che qui si intrecciano con una composizione particolare: la bambina (forse si tratta della figlia Luce) calamita lo sguardo dell'osservatore e le sue forme tessono una trama di colore con l'ambiente circostante. L'atmosfera è mobile. Balla si concentra sul viso e sul fascio di fiori che la protagonista tiene in mano, mentre ci accorgiamo che i piedi sono tagliati. In quest'opera sembra che il soggetto desideri liberarsi dalla sua natura bidimensionale per fondersi con lo spazio reale. Questa tela è dunque una testimonianza importante per la conoscenza dell'autore, che nel giro di pochi anni verrà consacrato come uno degli esponenti principali del Futurismo.",,,,,,,,,,,,,,,,,21100,Varese,VA,,"Via Cola di Rienzo, 42 21100 VA",,,http://www.bellalombardia.regione.lombardia.it/LBL/medium/OA-1o040-00020-IMG-0000478911.jpg,,SIRBEC,,,
art,,,"Per secoli produrre semilavorati metallici ha significato trasformare il materiale fuso in barre o piastre, farle raffreddare, spostarle, riscaldarle e dar loro la forma finale. Pochi chili di prodotto al giorno a fronte di un grande dispendio di tempo, spazio, acqua ed energia. Nel 1948 Ilario Properzi brevetta il Continuus Properzi, un sistema capace di produrre chili di filo, con una sola macchina e in pochi minuti, a partire dal metallo fuso. Il sistema dà vita a un prodotto innovativo e fondamentale per trasportare energia elettrica, tanto che il filo di alluminio diventa per tutti il ""Properzi rod"".",,,,,,,,,,,,,,,,,20123,Milano,MI,,"Via San Vittore, 21 20123 MI",,,http://www.bellalombardia.regione.lombardia.it/LBL/medium/PST-ST080-00032-IMG-0000043734.jpg,,SIRBEC,,,
art,"San Simonino da Trento, Sant'Antonio abate, Sant'Antonio di Padova, Madonna con Bambino e san Girolamo",,"La decorazione, interessata da ampie lacune, presenta una serie di immagini votive. A sinistra, in alto, troviamo l'effige di S. Simonino da Trento, il fanciullo di due anni ucciso nel 1475 a Trento e per il quale furono accusati ingiustamente un gruppo di ebrei considerati rei di un terribile rito sacrificale. In basso, entro nicchie, sono dipinti S. Antonio abate e S. Antonio di Padova, entrambi riconoscibili per la veste e per i tratti fisiognomici. A destra, due arcate aperte su un paesaggio, accolgono una Madonna, frammento, come suggerisce la sottostante sinopia, di una Madonna in trono con Gesù Bambino e di un S. Gerolamo. L'affresco è tra le poche testimonianze della fase decorativa della chiesa precedente l'intervento di Romanino, attivo sulle pareti del presbiterio. Databili negli anni a cavallo fra il XV e il XVI secolo, rivelano analogie tecniche e stilistiche con dipinti murali presenti in Valle Camonica e riconducibili alla bottega di Giovanni Pietro da Cemmo. Di particolare interesse è l'immagine frammentaria della Madonna in adorazione, di cui si è potuto recuperare la sinopia sottostante. Da essa emergono le tracce dell'attività progettuale del pittore, che prevedeva il Bambino sulla destra e la Madonna inginocchiata rivolta sempre a destra, quindi con una soluzione poi ribaltata nell'opera finale.",,,,,,,,,,,,,,,,,25043,Breno,BS,,Piazza S. Antonio 25043 BS,,,http://www.bellalombardia.regione.lombardia.it/LBL/medium/OA-BS230-00551-IMG-0000477944.jpg,,SIRBEC,,,
art,guerriero,,"L'oggetto, dalle forme antropomorfe, raffigura un guerriero con il volto dipinto, indossa un copricapo e una veste elaborata (uncu). Come accade spesso per gli oggetti rituali nel mondo andino, il vaso in terracotta possiede un gemello, conservato anch'esso presso il Museo delle Culture. L'opera appartiene alla cultura Huari, fiorita sulle Ande tra il VI e il XIII secolo. Il manufatto proviene dalla collezione di Federico Balzarotti donata al Comune di Milano nel 2002.",,,,,,,,,,,,,,,,,20121,Milano,MI,,"Via Tortona, 56 20121 MI",,,http://www.bellalombardia.regione.lombardia.it/LBL/medium/OA-6C040-02608-IMG-0000477339.jpg,,SIRBEC,,,
art,,,"Il Macchi MC 205 Veltro entra in servizio nel 1943 ed è considerato uno degli aerei della Seconda Guerra Mondiale più belli e maneggevoli. È equipaggiato con un motore da 1475 cavalli, armato con due mitragliatrici e due cannoni. Il nome Veltro ricorda il celebre cane da caccia che salverà l'Italia citato da Dante nella Divina Commedia. Il motto ""Incocca, tende, scaglia"" sulla fusoliera è ancora oggi utilizzato dalla Prima Brigata Aerea Operazioni Speciali.",,,,,,,,,,,,,,,,,20123,Milano,MI,,"Via San Vittore, 21 20123 MI",,,http://www.bellalombardia.regione.lombardia.it/LBL/medium/PST-ST120-00371-IMG-0000043769.jpg,,SIRBEC,,,
art,Pescarenico,,"Il borgo di Pescarenico viene qui rappresentato nel suo aspetto caratteristico, con le case affacciate sull'Adda, poche figure sulla riva ed una barca in primo piano, a sinistra. Il confronto con le parole di Alessandro Manzoni nel IV capitolo de ""I Promessi Sposi"", testimonia l'efficacia della rappresentazione: ""E' Pescarenico una terricciola sulla riva sinistra dell'Adda, o vogliam dire del lago, poco discosto dal ponte: un gruppetto di case, abitate la più parte da pescatori, e addobbate qua e là di tramagli e di reti tese ad asciugare..."". Autore del dipinto è il pittore lecchese Giovanni Battista Todeschini (1857-1938), nipote dell'abate Antonio Stoppani, che rappresenta Pescarenico con una veduta tuttora attuale. L'opera è esposta in una sala del Museo Manzoniano appositamente dedicata a Pescarenico: uno dei più famosi luoghi manzoniani, nonché l'unico ad essere descritto espressamente nel celebre romanzo.",,,,,,,,,,,,,,,,,23900,Lecco,LC,,"Via Don Guanella, 1 23900 LC",,,http://www.bellalombardia.regione.lombardia.it/LBL/medium/OA-G1050-00794-IMG-0000474797.jpg,,SIRBEC,,,
art,Natura morta con palla,,"Una scatola di legno, addossata ad una parete, occupa gran parte della composizione; al suo interno si trovano alcuni oggetti sospesi: una palla, un regolo e una forma sferica che ricorda un astrolabio. La ""Natura morta con palla"" appartiene ad un insieme di diciannove opere realizzate da Morandi tra 1918 e 1919, quando l'autore aderisce alla pittura ""Metafisica"". Di proprietà del fratello Raffaello Franche, il dipinto viene esposto per la prima volta alla Quadriennale di Roma del 1939; successivamente transita nelle collezioni Valdameri e Frua De Angeli prima di entrare nella raccolta Jucker, acquistata dal Comune di Milano.",,,,,,,,,,,,,,,,,20121,Milano,MI,,Piazza Duomo 20121 MI,,,http://www.bellalombardia.regione.lombardia.it/LBL/medium/OA-RL480-00085-IMG-0000479779.jpg,,SIRBEC,,,
art,,,,,,,,,,,,,,,,,,,,26029,Soncino,CR,,"Via Lanfranco, 8 26029 CR",,,http://www.bellalombardia.regione.lombardia.it/LBL/medium/BDM-CR240-00003-IMG-0000088979.jpg,,SIRBEC,,,
art,Raccolte di Palazzo Vertemate Franchi,,"Palazzo Vertemate risale alla seconda metà del XVI secolo, con le sue decorazioni ad affresco, le ricche boiseries e i soffitti intagliati completati entro il primo decennio del Seicento. Dimora sontuosa, nel tempo ha perso quasi tutti gli arredi originali, con l'eccezione di alcuni ritratti di famiglia. Letti a baldacchino, tavoli, lampade, busti in marmo, sculture, tappeti, mappamondi, la riproduzione in scala di un galeone e numerose tele a olio sono solo alcune fra le molte opere che oggi si possono ammirare. Si tratta di oggetti d'epoca acquistati sul mercato antiquario dai coniugi Brianzi e dai successivi proprietari, che nel Novecento hanno riportato la villa all'antico splendore.",,,,,,,,,,,,,,,,,23020,Piuro,SO,,"Via Cortinaccio, 1 23020 SO",,,http://www.bellalombardia.regione.lombardia.it/LBL/medium/COL-COL-SO020-0000002-IMG-0000001901.jpg,,SIRBEC,,,
art,Motivi decorativi a volute e rosoncini,,"Presso il Museo del Tesoro di S. Lorenzo è conservato un bel calice d'argento filigranato proveniente dalla chiesa di S. Maria di Borgonuovo, antico quartiere di Chiavenna. Grazie ad un'iscrizione incisa sotto il piede sappiamo che l'opera fu commissionata da Carlo Crollalanza ed eseguita dall'orafo Giuseppe Garotti nel 1690. Si tratta di un prezioso manufatto messo in relazione con i cosiddetti ""tesori degli emigranti"", oggetti liturgici donati alle chiese dei borghi d'origine con il contributo di emigranti della Valchiavenna che nei secoli passati andarono a cercare fortuna in città lontane come Venezia.",,,,,,,,,,,,,,,,,23022,Chiavenna,SO,,"Piazza don Pietro Bormetti, 3 23022 SO",,,http://www.bellalombardia.regione.lombardia.it/LBL/medium/OA-SO070-00017-IMG-0000478039.jpg,,SIRBEC,,,
art,Collezione privata Luigi e Piero Lechi,,"La collezione appartenuta ai Conti Luigi e Piero Lechi si compone di circa 360 opere suddivise tra dipinti databili tra la fine del XV secolo e la prima metà di XVIII e disegni e incisioni dal XVI al XVIII secolo. I soggetti dei dipinti annoverano autentici capolavori di ambito lombardo e non, riconducibili a soggetti mitologici, religiosi, allegorie, ritratti, quadri di genere, battaglie, paesaggi e nature morte. Degni di particolare nota sono i dipinti legati al tema della pittura ""della realtà"" e alla ritrattistica di ambito lombardo, soprattutto bresciano.",,,,,,,,,,,,,,,,,25018,Montichiari,BS,,"Via Martiri della Libertà, 33 25018 BS",,,http://www.bellalombardia.regione.lombardia.it/LBL/medium/COL-COL-LMD30-0000001-IMG-0000001716.jpg,,SIRBEC,,,
art,Elasticità,,"La scelta del titolo ""Elasticità"" per una scena di un cavallo al galoppo, sullo sfondo di un paesaggio urbano, è rivelatrice del nuovo interesse di Umberto Boccioni per le proprietà della materia, in particolare per la capacità elastica degli oggetti e dei muscoli, anticipando quella interpretazione del moto che è propria dei dinamismi scultorei. Come rivela un passaggio del testo ""Pittura Scultura Futuriste"", scritto da Boccioni nel 1914, l'elasticità è uno degli aspetti della ""legge di moto che caratterizza il corpo: l'oggetto porta in sé strettamente legati alla propria sostanza organica... i suoi caratteri generali: porosità, impermeabilità, rigidità, elasticità, ecc."". Finché Boccioni fu in vita il dipinto fu inviato alle mostre di maggior rilievo e fu tra i più riprodotti. La storia collezionistica dell'opera è nota: essa passa dalla collezione Marinetti a quella dei coniugi Magda e Riccardo Jucker negli anni quaranta , seguendone le vicissitudini sino al definitivo ingresso, nel 1992, nelle Civiche Raccolte.",,,,,,,,,,,,,,,,,20121,Milano,MI,,Piazza Duomo 20121 MI,,,http://www.bellalombardia.regione.lombardia.it/LBL/medium/OA-RL480-00084-IMG-0000479778.jpg,,SIRBEC,,,
art,testa umana e testa leonina,,"Collocato nella prima sala del Museo, in funzione di scenografico accesso alle collezioni, il grande arco costituisce l'unica parte superstite della fronte esterna della Posterla Fabbrica o dei Fabbri, uno degli ingressi secondari, nella cerchia delle mura comunali di Milano, edificate a partire dal 1171. L'arcata, a tutto sesto, presenta scolpite all'imposta dell'arco due protomi leonine: una maschile barbuta e l'altra leonina. Le due protomi, oltre ad una funzione decorativa, probabilmente svolgevano una funzione apotropaica, proteggendo il varco dai nemici invisibili e dalle oscure forze del male, secondo una consuetudine dell'epoca. Lo studio dei due elementi induce a datare la porta ai primi decenni del Duecento. Il nome dell'edificio, cui apparteneva l'arco, deriva da quello del borgo extramurale che lo fronteggiava, dove si concentravano le officine addette alla lavorazione dei metalli. La porta viene demolita nel 1900.",,,,,,,,,,,,,,,,,20121,Milano,MI,,Piazza Castello 20121 MI,,,http://www.bellalombardia.regione.lombardia.it/LBL/medium/OA-RL480-00007-IMG-0000477472.jpg,,SIRBEC,,,
art,Le due madri,,"Insieme con ""Maternità"" di Gaetano Previati, è la prima opera realizzata con tecnica divisionista ad essere esposta alla Triennale milanese del 1891. Il soggetto è tra i più diffusi nella pittura e nella letteratura di fine secolo: il tema della glorificazione della madre. Nel dipinto il pittore mostra la commovente corrispondenza di affetti tra l'amore umano e quello animale. L'intimità della stalla, spoglia e avvolta dal sonno, è resa attraverso una luce calda e avvolgente e un forte naturalismo.",,,,,,,,,,,,,,,,,20121,Milano,MI,,"Via Palestro, 16 20121 MI",,,http://www.bellalombardia.regione.lombardia.it/LBL/medium/OA-2d050-00111-IMG-0000477307.jpg,,SIRBEC,,,
