category,name,nameEN,description,descriptionEN,hours,manager,website,email,phone,fax,weeklyClosing,services,ticketCost,ticketEmail,ticketPhone,ticketHours,ticketReductions,addressStreet,addressLocation,addressCap,addressMunicipalities,addressProvince,addressRegion,addressText,latitude,longitude,photo,accessibility,visibleCopy,sponsor,hidden,unreachable
art,Agnus Dei,,"Le notizie sulla costruzione del pulpito provengono dal Libro Mastro dell'Archivio Parrocchiale della Chiesa di San Giovanni Battista di Campodolcino. Tra le antiche carte si trova scritto che il pulpito venne realizzato nel 1779 dall'intagliatore Guglielmo Buzzetti di Morbegno e dall'indoratore Luigi Maranesi.Del piccolo pulpito di stile barocco in legno intagliato, dipinto e dorato si conservano i tre distinti elementi che formano la balaustra, decorati con effetti a finto marmo venato di verde e con la figura a rilievo dell'Agnello Mistico nel pannello centrale.",,,,,,,,,,,,,,,,,23021,Campodolcino,SO,,"Piazza S. Antonio, 15 23021 SO",,,http://www.bellalombardia.regione.lombardia.it/LBL/medium/OA-SO100-00002-IMG-0000478165.jpg,,SIRBEC,,,
art,Flautista,,"La tela è ricordata per la prima volta nella collezione formata dal cardinale Richelieu nella prima metà del XVII secolo; successivamente, ricompare solo nel 1894 in occasione della mostra degli Old Masters provenienti dalle collezioni private britanniche. Il quadro apparteneva allora a lord William Archer , terzo Earl of Amherst (1836-1910). Prima di approdare presso la Pinacoteca Tosio Martinengo come deposito della Banca Popolare di Brescia e poi di Unicredit Group, la tela ha avuto diversi passaggi di proprietà.Fin dalla sua comparsa all'esposizione londinese del 1894, il Flautista gradualmente si impose come uno dei capolavori del pittore bresciano Giovanni Gerolamo Savoldo. Il dipinto si distingue per la funzione dominante, coordinatrice e compositiva assunta dal luminismo savoldesco. Emergono anche evidenti rapporti con la ritrattistica di Lotto, anche in virtù dell'ineffabilità psicologica affiorante nello sguardo del protagonista, sottilmente ambiguo tra la tacita intesa con l'osservatore e il distacco di una solitaria meditazione.",,,,,,,,,,,,,,,,,25121,Brescia,BS,,"Via dei Musei, 81/b 25121 BS",,,http://www.bellalombardia.regione.lombardia.it/LBL/medium/OA-2k100-00002-IMG-0000477976.jpg,,SIRBEC,,,
art,,,"L'AB 47 è stato il primo elicottero brevettato per uso civile. Fu progettato prevalentemente da Arthur M. Young che lavorò con la Bell Helicopters a partire dal 1941. In Italia ne sono stati prodotti 1.200 modelli costruiti su licenza dalla Agusta e in tutto il mondo ben 56.000 esemplari fino al 1974. Questo modello è stato selezionato come elicottero da addestramento balistico dalle forze armate italiane e di molti paesi. Venne collaudato il 9 maggio 1955 e consegnato all'Azienda di Stato Foreste Demaniali (ASFD). L'AB 47 G è anche il primo elicottero ad aver sorvolare Roma. Nel 1957 ha partecipato a numerosi salvataggi nell'alluvione del Polesine e fu impiegato fino agli anni '60 nella sorveglianza del delta del Po. Oggi ne è rimasto un unico esemplare in Italia che, probabilmente, costituisce anche l'unico di tutta Europa. Nel 2009 questo elicottero è stato trovato in un deposito ed è stato successivamente restaurato a cura di un gruppo di lavoratori Agusta e del Corpo Forestale dello Stato.",,,,,,,,,,,,,,,,,21017,Samarate,VA,,"Via Giovanni Agusta, 510 21017 VA",,,http://www.bellalombardia.regione.lombardia.it/LBL/medium/PST-3o210-00397-IMG-0000043855.jpg,,SIRBEC,,,
art,Ritratti di Cesari,,"I sei busti raffiguranti imperatori romani che ornano il prospetto orientale del palazzo della Loggia, quello che affaccia sull'omonima piazza, costituiscono un esempio di grande interesse storico e stilistico di scultura rinascimentale di ispirazione antiquaria. Furono realizzati dallo scultore lombardo Gasparo Cairano fra il 1493 e il 1495 e fanno parte del più ampio progetto decorativo del Palazzo della Loggia improntato alla celebrazione delle nobili origini romane della città.",,,,,,,,,,,,,,,,,25121,Brescia,BS,,"Piazza della Loggia, 6 25121 BS",,,http://www.bellalombardia.regione.lombardia.it/LBL/medium/OA-2k090-00047-IMG-0000478029.jpg,,SIRBEC,,,
art,NATIVITA' DI GESU',,"Intorno al 1545, il pittore bresciano Girolamo Romanino dipinse questa Natività. La grande tela ornava una cappella laterale della chiesa di San Giuseppe a Brescia, che era intitolata all'Immacolata Concezione. Questo tema influì profondamente sulla composizione del dipinto, determinando molte delle scelte compiute dal pittore.Romanino in effetti presenta la scena della Natività inserendo diversi elementi che suggeriscono la purezza della Vergine Maria. In particolare, il pittore ha riservato ampio spazio alla rappresentazione del manto della Madonna, il cui colore bianco perla ha un chiaro significato simbolico e che va ad occupare buona parte della zona inferiore del dipinto, del quale è in un certo senso il protagonista. In questa fase della sua vita, del Romanino mostra una grande attenzione per il colore luminoso e cangiante, probabilmente influenzato dalle ricerche condotte da Savoldo: il dipinto si costruisce quindi sul contrasto tra la penombra dorata del tramonto e il colore chiaro e argenteo del primo piano.",,,,,,,,,,,,,,,,,25121,Brescia,BS,,"Via dei Musei, 81/b 25121 BS",,,http://www.bellalombardia.regione.lombardia.it/LBL/medium/OA-2k100-00005-IMG-0000477979.jpg,,SIRBEC,,,
art,Civico Museo Archeologico di Casteggio e dell'Oltrepo Pavese,,"Il percorso museale è articolato in quattro sezioni: Geologia e Paleontologia; Preistoria e Protostoria; Collezioni; Età romana, tardoantica e medievale.Nella I forme di vita, resti fossili animali e vegetali, precedenti all'arrivo dell'uomo in Oltrepo pavese. Nella II manufatti in ceramica, pietra e bronzo, una rara testina celtica, documentano i primi insediamenti umani in Oltrepo dal Neolitico, con la capanna di Cecima, fino all'arrivo dei popoli celtici (II secolo a.C.), passando per l'età del Rame, del Bronzo e del Ferro. Nelle Collezioni oggetti donati da privati al Comune di Casteggio, provenienti dal territorio o dall'Italia centrale e meridionale. Nell'ultima sezione corredi funerari dallo scavo cittadino del 1987 nella necropoli dell'Area Pleba, un calice di produzione renana, un pregiato vassoio realizzato a stampo, uno specchio, statuette di Mercurio, Giove, di un bambino e la patera in terra sigillata dotata di bollo in planta pedis.",,,,,,,,,,,,,,,,,27045,Casteggio,PV,,"Palazzo Certosa Cantù, via Circonvallazione, 64 27045 PV",,,http://www.bellalombardia.regione.lombardia.it/LBL/medium/COL-COL-PV300-0000013-IMG-0000001858.jpg,,SIRBEC,,,
art,Pluteo di Teodote,,"Il pluteo istoriato con l'albero della vita tra draghi affrontati, connotato da una raffinata eleganza formale e da una felice inventiva iconografica, è tra gli esempi più significativi e più noti della plastica di età longobarda a livello europeo. La lastra marmorea - proveniente dal monastero femminile di Santa Maria Teodote, detto anche della Pusterla, in Pavia - è interamente decorata: al centro, due mostri alati con testa di leone e coda anguiforme, disposti simmetricamente ai lati dell'albero della vita. Negli angoli inferiori campeggiano due piccoli delfini, cui corrisponde in quelli superiori la porzione terminale tripartita della coda dei draghi. Una sottile bordura ed un'alta fascia omogenea a girali, in cui si alternano fiori e tralci di vite, di squisita fattura, incorniciano la scena centrale. Nel bassorilievo convivono modelli di derivazione 'classica' con temi inediti e originali, quali le spirali annodate che generano i corpi dei mostri alati. Il raffinato rigore distributivo appare derivato da una stoffa orientale, allo stesso modo l'albero della vita è un motivo mutuato dall'Oriente che si lega ai temi del rinnovamento, della vita eterna e simbolizza il cosmo e l'uomo.",,,,,,,,,,,,,,,,,27100,Pavia,PV,,"Castello Visconteo, Viale XI Febbraio, 35 27100 PV",,,http://www.bellalombardia.regione.lombardia.it/LBL/medium/RA-PV300-00001-IMG-0000091406.jpg,,SIRBEC,,,
art,Elefante,,"Costruito in concomitanza con i lavori di risistemazione della Corte Ducale, intrapresi a partire dal 1472 in previsione della trasformazione del Castello Sforzesco da fortezza militare a dimora signorile per il duca Galezzo Maria Sforza, il 'Portico dell'Elefante' si presenta oggi purtroppo fortemente lacunoso a livello di decorazione pittorica. Ciò che rimane degli originali affreschi interessa le prime due campate, entrambe incorniciate da un arco a conci bianchi e neri e decorate con misteriose figure animali. Sulla sinistra sono dipinte, su uno sfondo campestre, le zampe di un leone, oggi purtroppo quasi completamente perduto. A destra compare invece l'animale da cui ha origine il nome della struttura, un gigantesco pachiderma circondato ai lati da misteriosi personaggi abbigliati con vesti di foggia orientale, che probabilmente dovevano essere conosciuti nella Milano del XV secolo come esemplari di attrazioni itineranti o, più probabilmente, attraverso la diffusione di disegni esotici eseguiti da artisti e pittori in contatto con il mondo orientale e nord-africano.",,,,,,,,,,,,,,,,,20121,Milano,MI,,Piazza Castello 20121 MI,,,http://www.bellalombardia.regione.lombardia.it/LBL/medium/OA-3o210-01289-IMG-0000479503.jpg,,SIRBEC,,,
art,Collezioni del Museo Archeologico,,Il museo illustra lo sviluppo storico e archeologico del territorio e dei gruppi umani che lo hanno abitato e trasformato nel lungo corso della storia. I numerosi reperti coprono un arco di tempo che va dalla Preistoria all'Alto Medioevo. L'allestimento del Museo è stato selezionato e pubblicato sul sito www.allestimenti.museali.it del Ministero dei Beni Culturali come esempio di allestimento museale archeologico innovativo in Italia.,,,,,,,,,,,,,,,,,23900,Lecco,LC,,"Corso Matteotti, 32 23900 LC",,,http://www.bellalombardia.regione.lombardia.it/LBL/medium/COL-COL-LC240-0000001-IMG-0000001676.jpg,,SIRBEC,,,
art,Arte del Contrappunto Plastico n. 1,,"Opera di grande musicalità e ritmo, questa scultura è stata realizzata nel 1970 da Fausto Melotti, artista, scrittore e teorico di spicco della scena culturale dell'Italia del Novecento. Per l'artista trentino la scultura è essenzialmente un linguaggio basato sulle forme e sullo spazio da esse penetrato, da cui la scelta accurata del luogo di esposizione, all'interno del Parco di sculture di Briosco, a stretto contatto con la natura. La scultura è costituita da sagome curvilinee, lamine, dischi e fili riconducibili a forme geometriche e sottili diaframmi che enfatizzano il legame di Melotti con il linguaggio musicale. Le note infatti rompono il silenzio almeno quanto gli elementi scultorei metallici rompono lo spazio. Da qui la presenza nel titolo dell'opera del termine ""contrappunto"". La scelta di lavorare con la lamina metallica, inoltre, valorizza il senso di luminosità e di instabilità della scultura, accentuato dall'effetto di riflessione ottenuto nello specchio d'acqua sopra il quale è stata posizionata una vasca di recupero per l'acqua piovana.",,,,,,,,,,,,,,,,,20836,Briosco,MB,,"Via Col del Frejus, 3 20836 MB",,,http://www.bellalombardia.regione.lombardia.it/LBL/medium/OA-3o210-01243-IMG-0000475939.jpg,,SIRBEC,,,
art,Statua di Eracle in riposo,,"La statua, colossale, raffigura l'eroe che si riposa appoggiato alla clava coperta con la ""leonté"", la pelle del leone di Nemea, a sinistra, mentre nella mano destra dietro la schiena stringe i pomi d'oro custoditi dalle Esperidi, frutto della sua ultima fatica. Il modello deriva dallo scultore greco Lisippo, attivo nella seconda metà del IV secolo a.C., ed è noto da numerose copie e varianti di età romana, tra cui il celebre Eracle Farnese, risalente alla fine del II secolo d.C. e conservato presso il Museo Archeologico Nazionale di Napoli. La scultura è stata ritrovata presso la Chiesa di S. Vito al Pasquirolo, nell'area compresa fra corso Vittorio Emanuele e corso Europa, dove scavi archeologici hanno in seguito riconosciuto un vastissimo impianto termale di età tardoimperiale, ricordato dalle fonti antiche come ""terme erculee"" in quanto edificate dall'imperatore Massimiano detto Erculeo (286-305 d.C.). La statua fu sicuramente utilizzata per decorare le nuove Terme Erculee, delle quali risulta essere più antica di circa 150-200 anni, mentre sconosciuta è la sua collocazione originaria. La foglia è un'aggiunta ottocentesca.",,,,,,,,,,,,,,,,,20123,Milano,MI,,"Corso Magenta, 15 20123 MI",,,http://www.bellalombardia.regione.lombardia.it/LBL/medium/RA-G0380-00040-IMG-0000095423.jpg,,SIRBEC,,,
art,Madonna con san Cristoforo e due committenti,,"Già assegnato alla bottega di Jacopo Tintoretto, il dipinto è oggi attribuito alla mano del grande maestro veneziano, l'ultimo dei grandi ""vecchi"" da molti additato come padre della pittura ""moderna"". L'opera, che proviene quasi certamente da qualche chiesa veneziana, forse dall'Oratorio della Confraternita dei Mendicanti, raffigura il momento culminante della conversione di San Cristoforo, santo patrono dei viandanti: l'uomo, di statura gigantesca, sta attraversando il fiume sprofondando sotto il peso del bambino che porta sulle spalle. Solo dopo aver raggiunto a fatica la sponda opposta, il fanciullo gli rivelerà di essere Cristo e che quella notte ha portato sulle spalle il peso del mondo. Assistono alla scena due dignitari del Doge, riccamente abbigliati, che sono i donatori dell'opera. La pennellata energica, le forme monumentali e i contrasti luminosi, che creano effetti di suggestione drammatica, consentono di riferire il dipinto ad una fase matura del Tintoretto, molto probabilmente intorno al 1575.",,,,,,,,,,,,,,,,,24022,Alzano Lombardo,BG,,"Piazza Italia, 8 24022 BG",,,http://www.bellalombardia.regione.lombardia.it/LBL/medium/OA-BG150-00001-IMG-0000475372.jpg,,SIRBEC,,,
art,,,"Il grandioso Salone, decorato in stile impero, è l'ambiente più sontuoso della villa. Costruito tra il 1829 e il 1830 per volere del duca Pompeo Litta Visconti Arese come ambiente di rappresentanza per ospitare banchetti, il salone viene progettato nell'insieme e in ogni particolare da Luigi Canonica, secondo lo stile neoclassico della grandeur imperiale napoleonica. Qui Canonica disegna la geometria del pavimento a mosaico veneziano, progetta il chiaroscuro del soffitto con figure mitologiche e inusuali bouquet di frutta e verdura, le consolle, le specchiere, i profili delle porte, i lampadari di cristallo, la stufa a parete, le grandi semicolonne corinzie e i fregi in stucco con figure di putti. In raffinato equilibrio con la decorazione ottocentesca del salone, due grandi opere dell'artista contemporaneo David Simpson dalle cangianti cromie che riprendono i colori dell'ambiente in complesse variazioni, che spaziano dal grigio, all'azzurro e al blu scuro, secondo l'incidenza della luce naturale che irrompe dalle porte finestre affacciate sul parco.",,,,,,,,,,,,,,,,,21100,Varese,VA,,"Piazzale Litta, 1 21100 VA",,,http://www.bellalombardia.regione.lombardia.it/LBL/medium/OA-3o210-01317-IMG-0000479087.jpg,,SIRBEC,,,
art,Altare dei Santi Pietro e Paolo,,"La cappella dei Santissi Pietro e Paolo costituisce l'ultima fatica in ordine di realizzazione del ciclo pittorico realizzato all'interno della chiesa di S. Vittore a Meda. Collocata nei pressi della controfacciata l'affresco stilisticamente è stato accostato all'opera di Giovanni da Monte, artista originario di Monte Cremasco (presso Como) attivo dal 1541. L'opera si differenzia da quelli delle altre cappelle della chiesa per la mancata divisione tra parete e lunetta sovrastante ed è dedicata ai due santi martiri del I secolo (Pietro e Paolo), qui raffigurati accanto alle relative scene di supplizio. Sopra di loro, una colonna di angeli senz'ali e nuvole culmina con la raffigurazione di due nudi umani (le anime dei Santi) circondati da angeli musicanti, diretti verso la colomba dello Spirito Santo. Sulla sinistra, accanto ad un altissimo albero, con i caratteristici attributi delle chiavi e del libro è raffigurato S. Pietro, crocefisso a testa in giù a Roma perché si considerava indegno di morire come il Signore. Nella parte opposta, nell'estremità destra dell'affresco, è invece raffigurato S. Paolo, con in mano il libro delle Lettere da lui scritte alle comunità cristiane e una grande spada.",,,,,,,,,,,,,,,,,20821,Meda,MB,,Piazza Vittorio Veneto 20821 MB,,,http://www.bellalombardia.regione.lombardia.it/LBL/medium/OA-3o210-01237-IMG-0000475893.jpg,,SIRBEC,,,
art,I ladri e l'asino,,"Si tratta di una delle rarissime opere di Paul Cézanne conservate nelle raccolte pubbliche italiane. L'artista, figlio di un banchiere e con un'ottima educazione classica, ci offre una interpretazione ironica e personale di un episodio de ""Le Metamorfosi"" dello scrittore latino Apuleio. Il testo narra le vicende del giovane Lucio che, trasformatosi in un asino, viene rapito dai ladri; l'episodio è quello nel quale Lucio descrive il covo dei ladri. Nella tela l'asino è rappresentato isolato al centro della scena, una scogliera a picco sul mare. I personaggi sulla sinistra in primo piano, vestiti con abiti contemporanei, non sono identificabili. Sullo sfondo due uomini misteriosi, uno dei quali è intento a fumare, sembrano osservare passivamente la vicenda. Il dipinto era di proprietà di Auguste Pellerin, tra i pochi collezionisti di Cézanne, nei primi anni novanta del XIX secolo. Nel 1933 viene acquistato da Carlo Grassi, industriale e collezionista d'arte, e donato al Comune di Milano nel 1958.",,,,,,,,,,,,,,,,,20121,Milano,MI,,"Via Palestro, 16 20121 MI",,,http://www.bellalombardia.regione.lombardia.it/LBL/medium/OA-B0050-00027-IMG-0000477300.jpg,,SIRBEC,,,
art,Madonna Immacolata,,"Opera tarda di Stefano Maria Legnani detto il Legnanino, geniale maestro del barocchetto milanese, la pala fu realizzata attorno al 1705. Presenta le ridotte misure tipiche di un'opera eseguita per la devozione privata. La tela, infatti, costituisce la pala dall'altare della cappella gentilizia della villa Sottocasa di Vimercate.La Madonna, assisa sul globo, rivolge uno sguardo dolce e malinconico al Bambino che le è accanto. Il gruppo è calato in un'atmosfera lunare, rischiarata dall'aureola di stelle che circonda il volto della Madonna. Concepita senza peccato, Maria calca assieme al Bambino il piede sulla testa del serpente, in segno di vittoria sul male. Con tecnica raffinata, il Legnanino porta le figure in primo piano, contrapponendo al tono freddo del fondo i colori preziosi e luminosi delle loro vesti: il panno rosa violaceo del Bambino dipinto con una lacca e il manto azzurro della Vergine ottenuto con il lapislazzuli. Non si conosce la collocazione originaria di quest'opera ma numerosi storici propendono nell'indicare la complessiva sistemazione della cappella gentilizia di Villa Sottocasa, secondo modelli di neoclassicismo lombardo, opera funzionale alla valorizzazione di questa tela.",,,,,,,,,,,,,,,,,20871,Vimercate,MB,,"Via Vittorio Emanuele II, 53 20871 MB",,,http://www.bellalombardia.regione.lombardia.it/LBL/medium/OA-4a020-00007-IMG-0000476077.jpg,,SIRBEC,,,
art,Madonna con Bambino,,"La tavola, a fondo oro, raffigura la Madonna in trono con il Bambino. La Vergine indossa un abito candido, con scollo accentuato e dall'elegante e aderente manica dai piccoli bottoni, con manto blu decorato da fiori e foderato di rosso. Il Bambino ripropone lo stesso colore per l'abitino, con ricami dorati come quello della Madre, e manto verde. Documentato dall'inizio dell'Ottocento nella chiesa della Madonna della Fontana a Camairago (Lodi), per poi essere spostato al Museo diocesano di Lodi. Si tratta di un'unica tavola rifilata in alto e in basso, così da lasciare troncato il suppedaneo del trono. L'impostazione delle due figure sembra rifarsi a modelli più veneti che lombardi. Ad esempio la posa del piccolo Gesù pare ricordare dell'immagine proposta da Paolo Veneziano nella Madonna di Cesena del 1347, così come il mantellino di opaco tessuto che lo avvolge a spirale. Il motivo del cuscino sotto i piedi, estraneo all'arte toscana e a quella lombarda, è invece presente in quella veneziana. Le aureole, molto ampie e con piccoli decori creati da un punzone a sedici punte, non corrispondono al repertorio comunemente in uso in Toscana e Lombardia nel secondo Trecento, ma avvicinano l'opera al tardo e discusso affrescocon la Madonna col Bambino e due angeli in S. Agostino a Cremona, sul quale aleggia il nome di Stefano da Ferrara, di cui è nota l'attività in territorio veneto, nonchè il tramite tra l'ambiente veneto e quello lombardo,",,,,,,,,,,,,,,,,,26900,Lodi,LO,,"Via Cavour, 31 26900 LO",,,http://www.bellalombardia.regione.lombardia.it/LBL/medium/OA-T0010-00244-IMG-0000475762.jpg,,SIRBEC,,,
art,Artemide cacciatrice,,"Questa statuetta di Artemide, corrispondente alla romana Diana, rappresenta la dea durante una battuta di caccia, accompagnata da un cane dal muso allungato. La figura, purtroppo priva della testa, indossa una corta veste, cinta sotto il seno e rimborsata sui fianchi, dove si apre anche un ampio panneggio svolazzante. Essa si trovava, forse, collocata in una delle nicchie della fontana monumentale che ornava il giardino della casa del Ninfeo. E', infatti, uso frequentissimo nel mondo romano abbellire i giardini con statue di divinità, che sono spesso copie di famose opere greche. In questa statuetta di Artemide è stata riconosciuta la copia di un originale greco più antico, ridotta nelle dimensioni per poter rispondere alle esigenze e ai gusti del padrone di casa. Sfuggita al saccheggio dei soldati di Vespasiano che incendiano la città nel 69 d.C., durante la guerra civile per la successione all'impero, dopo essere rimasta sepolta per quasi 2000 anni sotto le macerie della casa dove era ospitata, è ora tornata a risplendere al centro della nicchia del ninfeo, presso il Museo Archeologico San Lorenzo.",,,,,,,,,,,,,,,,,26100,Cremona,CR,,"Via S. Lorenzo, 4 26100 CR",,,http://www.bellalombardia.regione.lombardia.it/LBL/medium/RA-CR210-00007-IMG-0000095457.jpg,,SIRBEC,,,
history,"Cuggiono, Castelletto di Cuggiono",,"Nella valle del Parco del Ticino, su un terrazzamento dominante il naviglio Grande, è collocato Castelletto di Cuggiono. Un borgo che conserva ancora oggi la sua originaria struttura tardo medioevale, sviluppatosi lungo il naviglio e al suo antico ponte e attorno alla maestosa e barocca Villa Clerici. Oltre all'imponente scalinata barocca di Villa Clerici sul canale, nel borgo si trova anche una chiesa dalle origini antichissime, dedicata ai SS. Giacomo e Filippo. Il borgo rappresenta un ambito di attenzione per la sua particolare sensibilità derivante anche dalla natura incontaminata del Parco Regionale del Ticino che fa sfondo.",,,,,,,,,,,,,,,,,20012,Cuggiono,MI,,Cuggiono 20012 MI,45.49771712484697,8.793528252997982,,,SIRBEC,,,
art,Transito di S. Giuseppe,,"Nella pinacoteca di Palazzo Ducale, il Settecento è rappresentato dalla colta e raffinata sensibilità del mantovano Giuseppe Bazzani (1690-1769). In questa tela l'artista descrive il momento della morte di S. Giuseppe, ritratto sdraiato nel suo letto e circondato come in un abbraccio dalle figure di Maria, Gesù e alcuni angeli. Il petto del santo ed il bianco lenzuolo vengono inondati di luce e diventano il punto focale della scena. La tavolozza tende al monocromo, tutta costruita su colori terrosi e caldi, e la pennellata vaporizza le anatomie. Gli studiosi datano l'opera alla fine del sesto decennio del XVIII secolo. Si ritiene infatti che l'intero gruppo di dipinti con questo soggetto sia databile agli ultimi anni di attività del pittore e implichi, nella rappresentazione della sofferenza e del trapasso, riferimenti autobiografici.",,,,,,,,,,,,,,,,,46100,Mantova,MN,,"Piazza Sordello, 40 46100 MN",,,http://www.bellalombardia.regione.lombardia.it/LBL/medium/OA-MN020-00080-IMG-0000479652.jpg,,SIRBEC,,,
art,Il riposo,,"L'opera fu dipinta nel 1887 e nello stesso anno partecipò all'Esposizione Nazionale di Venezia; successivamente entrò in una delle più prestigiose collezioni italiane del primo Novecento, quella torinese di Riccardo Gualino, dalla quale fu acquistata nel 1937 per volontà del direttore della Pinacoteca Ettore Modigliani. Considerato dallo stesso Fattori tra le sue opere migliori - sintesi di quella poetica realista che permeava i suoi ritratti di paesaggi e genti della Maremma - il dipinto, replicato in una splendida incisione all'acquaforte che ha avuto un'ampia diffusione, viene oggi annoverato fra i massimi capolavori dell'Ottocento italiano.",,,,,,,,,,,,,,,,,20121,Milano,MI,,"Via Brera, 28 20121 MI",,,http://www.bellalombardia.regione.lombardia.it/LBL/medium/OA-RL480-00074-IMG-0000477413.jpg,,SIRBEC,,,
